Symbol,Name,Last Sale,Net Change,% Change,Market Cap,Country,IPO Year,Volume,Sector,Industry
DHI,D.R. Horton Inc. Common Stock,$85.34,1.32,1.571%,30240925801.00,United States,,4055924,Capital Goods,Homebuilding
DHIL,Diamond Hill Investment Group Inc. Class A Common Stock,$184.33,2.51,1.38%,584638539.00,United States,,4510,Finance,Investment Managers
DHR,Danaher Corporation Common Stock,$285.15,-2.48,-0.862%,203761593910.00,United States,,1641711,Health Care,Medical Specialities
DHT,DHT Holdings Inc.,$5.05,0.07,1.406%,841773799.00,Jersey,2005,2176808,Transportation,Marine Transportation
DIAX,Nuveen Dow 30SM Dynamic Overwrite Fund Common Shares of Beneficial Interest,$16.87,0.0301,0.179%,613509822.00,,2014,52258,Finance,Finance Companies
DIBS,1stdibs.com Inc. Common Stock,$9.58,-0.05,-0.519%,362850164.00,United States,2021,188859,Miscellaneous,Diversified Commercial Services
DICE,DICE Therapeutics Inc. Common Stock,$16.89,-0.07,-0.413%,645728599.00,United States,2021,120087,Health Care,Biotechnology: Pharmaceutical Preparations
DIDI,DiDi Global Inc. American Depositary Shares (each four representing one Class A Ordinary Share),$3.55,0.13,3.801%,16783284462.00,,2021,18303353,,
DIN,Dine Brands Global Inc. Common Stock,$74.26,1.70,2.343%,1278536128.00,United States,,251987,Consumer Services,Restaurants
DIOD,Diodes Incorporated Common Stock,$90.11,0.10,0.111%,4056550804.00,United States,,340000,Technology,Semiconductors
DIS,Walt Disney Company (The) Common Stock,$142.51,0.49,0.345%,259434795636.00,United States,,10931219,Consumer Services,Movies/Entertainment
DISA,Disruptive Acquisition Corporation I Class A Ordinary Shares,$9.68,0.00,0.00%,332750000.00,United States,2021,5005,Finance,Business Services
DISCA,Discovery Inc. Series A Common Stock,$28.34,-0.56,-1.938%,14338448171.00,United States,,6618975,Consumer Services,Television Services
DISCB,Discovery Inc. Series B Common Stock,$30.50,0.00,0.00%,15431286846.00,United States,,746,Consumer Services,Television Services
DISCK,Discovery Inc. Series C Common Stock,$28.08,-0.54,-1.887%,14206902774.00,United States,,5520065,Consumer Services,Television Services
DISH,DISH Network Corporation Class A Common Stock,$30.37,-0.28,-0.914%,16059705048.00,United States,1995,2269966,Consumer Services,Television Services
DJCO,Daily Journal Corp. (S.C.) Common Stock,$316.75,6.75,2.177%,437351296.00,United States,,1011,Consumer Services,Newspapers/Magazines
DK,Delek US Holdings Inc. Common Stock,$18.11,0.50,2.839%,1342402609.00,United States,2017,627514,Energy,Integrated oil Companies
DKL,Delek Logistics Partners L.P. Common Units representing Limited Partner Interests,$43.04,-0.41,-0.944%,1870478072.00,United States,2012,46290,Energy,Oil & Gas Production
DKNG,DraftKings Inc. Class A Common Stock,$21.50,-0.39,-1.782%,8740322094.00,United States,2019,17958814,Consumer Services,Services-Misc. Amusement & Recreation
DKS,Dick's Sporting Goods Inc Common Stock,$112.65,1.13,1.013%,9756157902.00,United States,2002,804386,Consumer Services,Other Specialty Stores
DLB,Dolby Laboratories Common Stock,$76.76,0.90,1.186%,7815575778.00,United States,2005,905713,Technology,EDP Services
DLO,DLocal Limited Class A Common Shares,$30.72,0.28,0.92%,9063273708.00,Uruguay,2021,514725,,
DLR,Digital Realty Trust Inc. Common Stock,$146.05,0.89,0.613%,41447157949.00,United States,2004,1812371,Consumer Services,Real Estate Investment Trusts
DLTH,Duluth Holdings Inc. Class B Common Stock,$14.55,0.22,1.535%,481059637.00,United States,2015,44055,Consumer Services,Department/Specialty Retail Stores
DLTR,Dollar Tree Inc. Common Stock,$135.72,2.23,1.671%,30531036327.00,United States,1995,1759757,Consumer Services,Department/Specialty Retail Stores
DLX,Deluxe Corporation Common Stock,$30.77,-0.62,-1.975%,1313879000.00,United States,,214315,Technology,Advertising
DLY,DoubleLine Yield Opportunities Fund Common Shares of Beneficial Interest,$17.84,-0.03,-0.168%,855352697.00,,2020,127572,Finance,Investment Managers
DM,Desktop Metal Inc. Class A Common Stock,$4.03,0.18,4.675%,1253387770.00,,2019,4850215,Technology,Computer peripheral equipment
DMLP,Dorchester Minerals L.P. Common Units Representing Limited Partnership Interests,$24.11,0.32,1.345%,891702901.00,United States,,66668,Energy,Oil & Gas Production
DMRC,Digimarc Corporation Common Stock,$29.02,0.00,0.00%,513991967.00,United States,,73325,Technology,EDP Services
DMTK,DermTech Inc. Common Stock,$13.28,0.58,4.567%,394644389.00,United States,2017,534374,Health Care,Managed Health Care
DNA,Ginkgo Bioworks Holdings Inc. Class A Common Stock,$6.10,0.06,0.993%,10203105830.00,United States,2021,13608137,Health Care,Biotechnology: Biological Products (No Diagnostic Substances)
DNAA,Social Capital Suvretta Holdings Corp. I Class A Ordinary Share,$9.85,0.01,0.102%,314116500.00,United States,2021,104441,,
DNAB,Social Capital Suvretta Holdings Corp. II Class A Ordinary Shares,$9.69,0.00,0.00%,309014100.00,United States,2021,13532,,
DNAC,Social Capital Suvretta Holdings Corp. III Class A ordinary shares,$9.8301,-0.0299,-0.303%,313481889.00,United States,2021,95110,,
DNAD,Social Capital Suvretta Holdings Corp. IV Class A Ordinary Shares,$9.70,0.0231,0.239%,309333000.00,United States,2021,8307,Health Care,Biotechnology: Pharmaceutical Preparations
DNB,Dun & Bradstreet Holdings Inc. Common Stock,$19.51,-0.10,-0.51%,8412498912.00,United States,2020,1032407,Technology,EDP Services
DNLI,Denali Therapeutics Inc. Common Stock,$35.92,2.09,6.178%,4386750870.00,United States,2017,670889,Health Care,Biotechnology: Biological Products (No Diagnostic Substances)
DNMR,Danimer Scientific Inc. Common Stock,$3.88,-0.20,-4.902%,389335942.00,,2020,3901706,Consumer Non-Durables,Plastic Products
DNN,Denison Mines Corp Ordinary Shares (Canada),$1.20,0.02,1.695%,968834975.00,Canada,,4271863,,
DNOW,NOW Inc. Common Stock,$9.00,0.09,1.01%,995029479.00,,2014,923204,Energy,Metal Fabrications
DNP,DNP Select Income Fund Inc. Common Stock,$11.04,0.01,0.091%,3810953540.00,United States,1987,476659,Finance,Investment Managers
DNUT,Krispy Kreme Inc. Common Stock,$14.77,0.32,2.215%,2470293356.00,United States,2021,1044069,Consumer Services,Specialty Foods
DNZ,D and Z Media Acquisition Corp. Class A Common Stock,$9.72,0.00,0.00%,349312500.00,,2021,4599,,
DOC,Physicians Realty Trust Common Shares of Beneficial Interest,$17.24,-0.19,-1.09%,3797790704.00,United States,2013,2326440,Consumer Services,Real Estate Investment Trusts
DOCN,DigitalOcean Holdings Inc. Common Stock,$58.20,0.98,1.713%,6184705004.00,United States,2021,1796790,Technology,Retail: Computer Software & Peripheral Equipment
DOCS,Doximity Inc. Class A Common Stock,$48.53,2.78,6.077%,9099914654.00,,2021,1817130,Technology,Retail: Computer Software & Peripheral Equipment
DOCU,DocuSign Inc. Common Stock,$118.41,-0.05,-0.042%,23430559088.00,United States,2018,3039007,Technology,EDP Services
DOLE,Dole plc Ordinary Shares,$14.95,0.13,0.877%,1418420778.00,,2021,542507,,
DOMA,Doma Holdings Inc. Common Stock,$3.60,0.00,0.00%,1161267271.00,,2021,587835,Finance,Real Estate
DOMO,Domo Inc. Class B Common Stock,$47.33,0.49,1.046%,1543438447.00,United States,2018,314993,Technology,Computer Software: Prepackaged Software
DOOO,BRP Inc. (Recreational Products) Common Subordinate Voting Shares,$79.25,0.66,0.84%,6498865739.00,Canada,,59831,,
DOOR,Masonite International Corporation Ordinary Shares (Canada),$95.21,-0.34,-0.356%,2829327102.00,Canada,,111530,,
DORM,Dorman Products Inc. Common Stock,$90.47,-1.06,-1.158%,2861001115.00,United States,,71357,Capital Goods,Auto Parts:O.E.M.
DOUG,Douglas Elliman Inc. Common Stock,$7.50,0.50,7.143%,609076193.00,,2021,511652,Consumer Services,Building operators
DOV,Dover Corporation Common Stock,$162.15,-1.00,-0.613%,23347111484.00,United States,,696374,Capital Goods,Industrial Machinery/Components
DOW,Dow Inc. Common Stock ,$59.91,-0.69,-1.139%,44078614333.00,,2019,6213645,Basic Industries,Industrial Specialties
DOX,Amdocs Limited Ordinary Shares,$77.87,0.70,0.907%,9704300189.00,Guernsey,,767138,Technology,EDP Services
DOYU,DouYu International Holdings Limited ADS,$2.19,-0.11,-4.783%,710457440.00,China,2019,3690084,Technology,Computer Software: Programming Data Processing
DPG,Duff & Phelps Utility and Infrastructure Fund Inc.,$14.03,-0.23,-1.613%,533032993.00,United States,2011,109014,Finance,Trusts Except Educational Religious and Charitable
DPZ,Domino's Pizza Inc Common Stock,$434.36,-3.71,-0.847%,15793478151.00,United States,2004,362563,Consumer Non-Durables,Food Distributors
DQ,DAQO New Energy Corp. American Depositary Shares each representing five ordinary shares,$37.17,-0.61,-1.615%,2732499769.00,China,2010,590615,Technology,Semiconductors
DRAY,Macondray Capital Acquisition Corp. I Class A Ordinary Shares,$9.84,-0.015,-0.152%,353625000.00,United States,2021,135,,
DRD,DRDGOLD Limited American Depositary Shares,$8.10,0.28,3.581%,692642170.00,South Africa,,189791,Basic Industries,Precious Metals
DRE,Duke Realty Corporation Common Stock,$57.31,-0.37,-0.641%,21826530693.00,United States,,1785089,Consumer Services,Real Estate Investment Trusts
DRH,Diamondrock Hospitality Company Common Stock,$9.57,0.20,2.134%,2015631869.00,United States,2005,1472947,Consumer Services,Real Estate Investment Trusts
DRI,Darden Restaurants Inc. Common Stock,$140.09,2.23,1.618%,17892809911.00,United States,,1235495,Consumer Services,Restaurants
DRQ,Dril-Quip Inc. Common Stock,$24.37,-0.14,-0.571%,862354017.00,United States,1997,293858,Energy,Metal Fabrications
DRVN,Driven Brands Holdings Inc. Common Stock,$28.67,0.61,2.174%,4798778436.00,United States,2021,418844,,
DSEY,Diversey Holdings Ltd. Ordinary Shares,$10.49,-0.19,-1.779%,3329852659.00,United States,2021,596998,Consumer Durables,Specialty Chemicals
DSGN,Design Therapeutics Inc. Common Stock,$12.94,0.20,1.57%,720272763.00,United States,2021,47149,Health Care,Biotechnology: Pharmaceutical Preparations
DSGX,Descartes Systems Group Inc. (The) Common Stock,$69.73,-0.80,-1.134%,5903174657.00,Canada,,155541,,
DSKE,Daseke Inc. Common Stock,$11.41,0.33,2.978%,713002605.00,United States,2015,469482,,
DSL,DoubleLine Income Solutions Fund Common Shares of Beneficial Interests,$15.64,-0.11,-0.698%,1595230390.00,,2013,382632,Finance,Trusts Except Educational Religious and Charitable
DSM,BNY Mellon Strategic Municipal Bond Fund Inc. Common Stock,$7.47,0.03,0.403%,369178687.00,United States,1989,83417,Finance,Investment Managers
DSU,Blackrock Debt Strategies Fund Inc. Common Stock,$11.32,0.00,0.00%,527419255.00,United States,1998,66513,Finance,Finance Companies
DSX,Diana Shipping inc. common stock,$3.95,0.20,5.333%,361563258.00,Greece,2005,384862,Transportation,Marine Transportation
DT,Dynatrace Inc. Common Stock,$47.29,0.05,0.106%,13512862701.00,United States,2019,4799865,Technology,EDP Services
DTC,Solo Brands Inc. Class A Common Stock,$10.25,0.15,1.485%,649825759.00,,2021,506616,Miscellaneous,Diversified Commercial Services
DTE,DTE Energy Company Common Stock,$119.60,-0.40,-0.333%,23169782449.00,United States,,976938,Public Utilities,Electric Utilities: Central
DTM,DT Midstream Inc. Common Stock ,$51.63,0.45,0.879%,4994297220.00,,2021,1414595,Public Utilities,Oil & Gas Production
DTOC,Digital Transformation Opportunities Corp. Class A Common Stock,$9.68,-0.05,-0.514%,403535000.00,United States,2021,8805,,
DUK,Duke Energy Corporation (Holding Company) Common Stock,$104.34,0.09,0.086%,80273287434.00,United States,,3046633,Public Utilities,Power Generation
DUOL,Duolingo Inc. Class A Common Stock,$94.24,2.76,3.017%,3531390589.00,United States,2021,359523,Technology,Computer Software: Prepackaged Software
DV,DoubleVerify Holdings Inc. Common Stock,$26.80,-0.01,-0.037%,4251500222.00,,2021,427399,Technology,Computer Software: Prepackaged Software
DVA,DaVita Inc. Common Stock,$109.01,-0.33,-0.302%,11108119000.00,United States,,524322,Health Care,Medical/Nursing Services
DVAX,Dynavax Technologies Corporation Common Stock,$12.75,0.13,1.03%,1529389683.00,United States,2004,1056061,Health Care,Biotechnology: Pharmaceutical Preparations
DVN,Devon Energy Corporation Common Stock,$52.59,-0.28,-0.53%,35603430000.00,United States,,10295505,Energy,Oil & Gas Production
DWAC,Digital World Acquisition Corp. Class A Common Stock,$83.88,-0.57,-0.675%,3121571888.00,United States,2021,21155804,,
DX,Dynex Capital Inc. Common Stock,$16.23,0.14,0.87%,595086015.00,United States,,593934,Consumer Services,Real Estate Investment Trusts
DXC,DXC Technology Company Common Stock ,$37.33,1.30,3.608%,9126358924.00,,,2836292,Technology,EDP Services
DXCM,DexCom Inc. Common Stock,$420.86,0.51,0.121%,40790607229.00,United States,2005,594817,Health Care,Medical Specialities
DXPE,DXP Enterprises Inc. Common Stock,$27.55,-0.96,-3.367%,516578947.00,United States,,135311,Capital Goods,Industrial Machinery/Components
DY,Dycom Industries Inc. Common Stock,$86.92,1.49,1.744%,2623305401.00,United States,,241839,Basic Industries,Water Sewer Pipeline Comm & Power Line Construction
DYN,Dyne Therapeutics Inc. Common Stock,$6.86,0.17,2.541%,353485297.00,United States,2020,78039,Consumer Durables,Specialty Chemicals
DZSI,DZS Inc. Common Stock,$14.17,-0.05,-0.352%,385970537.00,United States,,42064,Public Utilities,Telecommunications Equipment
E,ENI S.p.A. Common Stock,$30.17,-0.71,-2.299%,53397229427.00,Italy,,919720,Energy,Oil & Gas Production
EA,Electronic Arts Inc. Common Stock,$136.40,-1.31,-0.951%,38575030705.00,United States,,1726076,Technology,Computer Software: Prepackaged Software
EAC,Edify Acquisition Corp. Class A Common Stock,$9.74,0.00,0.00%,336030000.00,United States,2021,7746,,
EAD,Allspring Income Opportunities Fund Common Shares,$8.20,-0.03,-0.365%,496806955.00,United States,2003,130673,Finance,Finance/Investors Services
EAF,GrafTech International Ltd. Common Stock,$9.84,-0.08,-0.806%,2590106527.00,United States,2018,7687434,Consumer Durables,Metal Fabrications
EAT,Brinker International Inc. Common Stock,$38.95,1.19,3.151%,1737137438.00,United States,,1331057,Consumer Services,Restaurants
EB,Eventbrite Inc. Class A Common Stock,$14.34,-0.04,-0.278%,1362432573.00,United States,2018,632167,Technology,EDP Services
EBAY,eBay Inc. Common Stock,$58.70,-0.59,-0.995%,36746421945.00,United States,1998,5717990,Consumer Services,Catalog/Specialty Distribution
EBC,Eastern Bankshares Inc. Common Stock,$20.95,-0.03,-0.143%,3903096705.00,United States,2020,576665,Finance,Major Banks
EBF,Ennis Inc. Common Stock,$18.70,0.08,0.43%,486549802.00,United States,,81385,Consumer Services,Office Equipment/Supplies/Services
EBIX,Ebix Inc. Common Stock,$26.91,-0.89,-3.201%,832687943.00,United States,,248180,Technology,EDP Services
EBR,Centrais Electricas Brasileiras S A American Depositary Shares (Each representing one Common Share),$6.36,0.03,0.474%,9978400588.00,,2016,1112369,Public Utilities,Electric Utilities: Central
EBS,Emergent Biosolutions Inc. Common Stock,$45.67,0.37,0.817%,2456984985.00,United States,2006,390689,Health Care,Biotechnology: Pharmaceutical Preparations
EBTC,Enterprise Bancorp Inc Common Stock,$39.60,-0.085,-0.214%,476719927.00,United States,,8632,Finance,Major Banks
EC,Ecopetrol S.A. American Depositary Shares,$14.83,0.10,0.679%,30488029105.00,Colombia,,781492,Energy,Oil & Gas Production
ECC           ,Eagle Point Credit Company Inc. Common Stock,$13.99,0.02,0.143%,534576591.00,United States,2014,235473,Finance,Trusts Except Educational Religious and Charitable
ECL,Ecolab Inc. Common Stock,$186.69,-0.79,-0.421%,53499250544.00,United States,,968540,Consumer Non-Durables,Package Goods/Cosmetics
ECOL,US Ecology Inc Common Stock,$26.78,-0.37,-1.363%,843900037.00,United States,,126035,Public Utilities,Environmental Services
ECOM          ,ChannelAdvisor Corporation Common Stock,$20.96,0.48,2.344%,629825950.00,United States,2013,188386,Technology,Computer Software: Prepackaged Software
ECPG,Encore Capital Group Inc Common Stock,$67.13,0.98,1.481%,1965011235.00,United States,,460527,,
ECVT,Ecovyst Inc. Common Stock,$9.64,-0.05,-0.516%,1321255595.00,United States,2017,650384,Basic Industries,Major Chemicals
ED,Consolidated Edison Inc. Common Stock,$86.60,0.51,0.592%,30634640538.00,United States,,1759031,Public Utilities,Power Generation
EDD,Morgan Stanley Emerging Markets Domestic Debt Fund Inc. Morgan Stanley Emerging Markets Domestic Debt Fund Inc. Common Stock,$5.46,0.01,0.183%,360863003.00,United States,2007,140526,Finance,Finance Companies
EDIT,Editas Medicine Inc. Common Stock,$19.32,0.59,3.15%,1321459793.00,United States,2016,1306769,Health Care,Biotechnology: Pharmaceutical Preparations
EDR,Endeavor Group Holdings Inc. Class A Common Stock,$30.98,-0.26,-0.832%,8182123742.00,,2021,690494,Consumer Services,Movies/Entertainment
EDU,New Oriental Education & Technology Group Inc. Sponsored ADR representing 1 Ordinary Share (Cayman Islands),$1.52,0.05,3.401%,2579388598.00,China,2006,19414707,Miscellaneous,Other Consumer Services
EEFT,Euronet Worldwide Inc. Common Stock,$137.12,0.70,0.513%,7247617874.00,United States,1997,309724,Technology,EDP Services
EFC,Ellington Financial Inc. Common Stock ,$17.39,-0.04,-0.229%,998667129.00,United States,2010,472366,Consumer Services,Real Estate Investment Trusts
EFR,Eaton Vance Senior Floating-Rate Fund Common Shares of Beneficial Interest,$14.50,0.03,0.207%,410642190.00,United States,2003,70725,Finance,Trusts Except Educational Religious and Charitable
EFSC,Enterprise Financial Services Corporation Common Stock,$50.53,-0.25,-0.492%,1911044600.00,United States,,74803,Finance,Major Banks
EFT,Eaton Vance Floating Rate Income Trust Common Shares of Beneficial Interest,$14.48,0.00,0.00%,418683524.00,United States,2004,100094,Finance,Finance Companies
EFX,Equifax Inc. Common Stock,$234.43,0.36,0.154%,28600816099.00,United States,,1039751,Technology,Advertising
EGAN,eGain Corporation Common Stock,$11.62,-1.125,-8.827%,365948660.00,United States,1999,545092,Technology,Computer Software: Prepackaged Software
EGBN,Eagle Bancorp Inc. Common Stock,$59.80,-0.17,-0.283%,1910615502.00,United States,,97854,Finance,Major Banks
EGHT,8x8 Inc Common Stock,$14.39,-0.02,-0.139%,1702784299.00,United States,,1735860,Technology,EDP Services
EGLE,Eagle Bulk Shipping Inc. Common Stock,$48.75,1.52,3.218%,662559349.00,United States,,350711,Transportation,Marine Transportation
EGLX,Enthusiast Gaming Holdings Inc. Common Stock,$2.35,0.12,5.381%,313924858.00,Canada,,527836,,
EGO,Eldorado Gold Corporation Ordinary Shares,$9.40,0.37,4.097%,1716994901.00,Canada,,2365668,,
EGP,EastGroup Properties Inc. Common Stock,$196.85,0.29,0.148%,8008699140.00,United States,,223335,Consumer Services,Real Estate Investment Trusts
EGRX,Eagle Pharmaceuticals Inc. Common Stock,$45.59,1.01,2.266%,588743744.00,United States,2014,166260,Health Care,Biotechnology: Pharmaceutical Preparations
EGY,VAALCO Energy Inc.  Common Stock,$5.32,0.13,2.505%,315819129.00,United States,,955749,Energy,Oil & Gas Production
EH,EHang Holdings Limited ADS,$15.88,-0.57,-3.465%,880213044.00,China,2019,382225,Transportation,Air Freight/Delivery Services
EHC,Encompass Health Corporation Common Stock,$59.50,-0.75,-1.245%,5919803393.00,United States,,960731,Health Care,Medical Specialities
EHTH,eHealth Inc. Common Stock,$18.41,-0.59,-3.105%,485805142.00,United States,2006,471578,Finance,Specialty Insurers
EIG,Employers Holdings Inc Common Stock,$38.56,-0.11,-0.284%,1078306493.00,United States,2007,65561,Finance,Property-Casualty Insurers
EIM,Eaton Vance Municipal Bond Fund Common Shares of Beneficial Interest $.01 par value,$12.43,0.15,1.221%,894378077.00,United States,2002,77497,Finance,Finance/Investors Services
EIX,Edison International Common Stock,$61.56,0.40,0.654%,23387152239.00,United States,,1649143,Public Utilities,Electric Utilities: Central
EJFA,EJF Acquisition Corp. Class A Ordinary Share,$9.89,-0.03,-0.302%,355421875.00,United States,2021,149284,Finance,Business Services
EL,Estee Lauder Companies Inc. (The) Common Stock,$314.43,1.08,0.345%,112775513884.00,United States,1995,1341343,Consumer Non-Durables,Package Goods/Cosmetics
ELAN,Elanco Animal Health Incorporated Common Stock,$25.06,0.09,0.36%,11855851994.00,United States,2018,3070707,Health Care,Biotechnology: Pharmaceutical Preparations
ELF,e.l.f. Beauty Inc. Common Stock,$28.19,-0.35,-1.226%,1469282054.00,United States,2016,414701,Consumer Non-Durables,Package Goods/Cosmetics
ELLO,Ellomay Capital Ltd Ordinary Shares (Israel),$26.179,1.179,4.716%,336381694.00,Israel,,1195,Public Utilities,Electric Utilities: Central
ELP,Companhia Paranaense de Energia (COPEL) American Depositary Shares (each representing one Unit consisting one Common Share and four non-voting Class B Preferred Shares),$6.64,0.03,0.454%,18170716900.00,Brazil,2021,534851,Public Utilities,Electric Utilities: Central
ELS,Equity Lifestyle Properties Inc. Common Stock,$77.13,-0.65,-0.836%,14178357846.00,United States,,969776,Consumer Services,Real Estate Investment Trusts
ELY,Callaway Golf Company Common Stock,$24.01,0.41,1.737%,4466191386.00,United States,1992,2143364,Consumer Non-Durables,Recreational Products/Toys
EM,Smart Share Global Limited American Depositary Shares,$1.51,-0.10,-6.211%,376648470.00,China,2021,95652,Consumer Services,Other Consumer Services
EMBK,Embark Technology Inc. Common Stock,$4.28,-0.02,-0.465%,1924087122.00,United States,,599451,Technology,Computer Software: Prepackaged Software
EMD,Western Asset Emerging Markets Debt Fund Inc Common Stock,$11.78,0.07,0.598%,715588021.00,United States,,168968,Finance,Finance/Investors Services
EME,EMCOR Group Inc. Common Stock,$114.98,-1.33,-1.143%,6136986672.00,United States,,253166,Capital Goods,Engineering & Construction
EMN,Eastman Chemical Company Common Stock,$118.43,-0.79,-0.663%,15921762242.00,United States,,1241788,Basic Industries,Major Chemicals
EMO,ClearBridge Energy Midstream Opportunity Fund Inc. Common Stock,$26.34,0.16,0.611%,347738863.00,United States,2011,58180,Finance,Investment Managers
EMR,Emerson Electric Company Common Stock,$95.73,0.35,0.367%,56863620000.00,United States,,4505570,Capital Goods,Industrial Machinery/Components
ENB,Enbridge Inc Common Stock,$43.38,0.51,1.19%,87891575065.00,Canada,,5974377,Energy,Oil & Gas Production
ENDP,Endo International plc Ordinary Shares,$3.14,0.06,1.948%,733726934.00,Ireland,,3744290,Health Care,Biotechnology: Pharmaceutical Preparations
ENFN,Enfusion Inc. Class A Common Stock,$14.33,0.34,2.43%,939808517.00,,2021,136425,Technology,Computer Software: Prepackaged Software
ENIA,Enel Americas S.A. American Depositary Shares,$5.63,0.00,0.00%,12079919257.00,Chile,,990747,Public Utilities,Electric Utilities: Central
ENIC,Enel Chile S.A. American Depositary Shares (Each representing 50 shares of Common Stock),$1.88,0.01,0.535%,2600662551.00,,2016,963968,Public Utilities,Electric Utilities: Central
ENJY,Enjoy Technology Inc. Common Stock,$3.26,-0.21,-6.052%,389967283.00,United States,2021,73885,Miscellaneous,Diversified Commercial Services
ENLC,EnLink Midstream LLC Common Units representing Limited Partner Interests,$8.51,0.15,1.794%,4152519312.00,,,3727473,Public Utilities,Natural Gas Distribution
ENOB,Enochian Biosciences Inc. Common Stock,$5.90,0.45,8.257%,310528806.00,United States,,160558,Health Care,Biotechnology: Pharmaceutical Preparations
ENPC,Executive Network Partnering Corporation Class A Common Stock,$9.79,-0.03,-0.305%,434519360.00,,2020,1678369,,
ENPH,Enphase Energy Inc. Common Stock,$140.77,-0.46,-0.326%,18991625305.00,United States,2012,3608346,Capital Goods,Electrical Products
ENR,Energizer Holdings Inc. Common Stock,$34.94,0.79,2.313%,2489255786.00,United States,2015,2494863,Basic Industries,Metal Fabrications
ENS,EnerSys Common Stock,$73.48,0.48,0.658%,3078172577.00,United States,2004,397932,Consumer Non-Durables,Telecommunications Equipment
ENSG,The Ensign Group Inc. Common Stock,$70.96,-1.93,-2.648%,3920881034.00,United States,2007,214952,Health Care,Hospital/Nursing Management
ENTA,Enanta Pharmaceuticals Inc. Common Stock,$63.01,1.67,2.723%,1292130507.00,United States,2013,262846,Health Care,Biotechnology: In Vitro & In Vivo Diagnostic Substances
ENTG,Entegris Inc. Common Stock,$127.44,-1.12,-0.871%,17270282147.00,United States,2000,1303963,Technology,Semiconductors
ENV,Envestnet Inc Common Stock,$71.23,-0.14,-0.196%,3892310853.00,United States,2010,213169,Technology,EDP Services
ENVA,Enova International Inc. Common Stock,$45.00,3.78,9.17%,1536480540.00,United States,2014,550491,Finance,Finance: Consumer Services
ENVX,Enovix Corporation Common Stock,$15.39,0.00,0.00%,2235330215.00,United States,2021,602695,Capital Goods,Industrial Machinery/Components
EOCW,Elliott Opportunity II Corp. Class A Ordinary Shares,$9.80,0.07,0.719%,746637500.00,,2021,6648,,
EOG,EOG Resources Inc. Common Stock,$114.69,0.99,0.871%,67103969921.00,United States,,3282773,Energy,Oil & Gas Production
EOI,Eaton Vance Enhance Equity Income Fund Eaton Vance Enhanced Equity Income Fund Shares of Beneficial Interest,$19.49,0.33,1.722%,771968398.00,United States,2004,108974,Consumer Services,Real Estate Investment Trusts
EOLS,Evolus Inc. Common Stock,$8.075,-0.305,-3.64%,448784178.00,United States,2018,1217644,Consumer Durables,Specialty Chemicals
EOS,Eaton Vance Enhance Equity Income Fund II Common Stock,$21.49,-0.22,-1.013%,1098702661.00,,2005,171541,Finance,Trusts Except Educational Religious and Charitable
EOT,Eaton Vance Municipal Income Trust EATON VANCE NATIONAL MUNICIPAL OPPORTUNITIES TRUST,$20.63,0.20,0.979%,320548094.00,United States,2009,36275,Finance,Trusts Except Educational Religious and Charitable
EPAC,Enerpac Tool Group Corp. Common Stock,$17.39,0.06,0.346%,1048948210.00,United States,,179153,Capital Goods,Industrial Machinery/Components
