Symbol,Name,Last Sale,Net Change,% Change,Market Cap,Country,IPO Year,Volume,Sector,Industry
INVE,Identiv Inc. Common Stock,$19.02,0.40,2.148%,422374078.00,United States,,59616,Technology,Computer peripheral equipment
INVZ,Innoviz Technologies Ltd. Ordinary shares,$4.15,0.08,1.966%,554831756.00,Israel,,888411,Capital Goods,Auto Parts:O.E.M.
INZY,Inozyme Pharma Inc. Common Stock,$6.10,-0.30,-4.688%,144354957.00,United States,2020,35693,Health Care,Biotechnology: Pharmaceutical Preparations
IOAC,Innovative International Acquisition Corp. Class A Ordinary Shares,$9.93,0.00,0.00%,318852300.00,United States,2022,11229,,
IOBT,IO Biotech Inc. Common Stock,$8.14,0.15,1.877%,234556273.00,Denmark,2021,9413,Health Care,Biotechnology: Pharmaceutical Preparations
IONM,Assure Holdings Corp. Common Stock,$4.0088,-0.1012,-2.462%,51388270.00,United States,,8229,Health Care,Assisted Living Services
IONS,Ionis Pharmaceuticals Inc. Common Stock,$31.50,0.43,1.384%,4448115473.00,United States,,844320,Health Care,Biotechnology: Pharmaceutical Preparations
IOSP,Innospec Inc. Common Stock,$90.34,-0.89,-0.976%,2226649097.00,United States,,78006,Basic Industries,Industrial Specialties
IOVA,Iovance Biotherapeutics Inc. Common Stock,$15.87,0.00,0.00%,2489989003.00,United States,,1516368,Health Care,Biotechnology: Pharmaceutical Preparations
IPA,ImmunoPrecise Antibodies Ltd. Common Stock,$5.70,-0.18,-3.061%,110749233.00,Canada,,13793,,
IPAR,Inter Parfums Inc. Common Stock,$96.08,-0.19,-0.197%,3048991190.00,United States,,65857,Consumer Non-Durables,Package Goods/Cosmetics
IPAX,Inflection Point Acquisition Corp. Class A Ordinary Share,$9.615,-0.035,-0.363%,317054625.00,United States,2021,662035,,
IPGP,IPG Photonics Corporation Common Stock,$149.95,2.57,1.744%,7993662957.00,United States,2006,274837,Technology,Semiconductors
IPHA,Innate Pharma S.A. ADS,$3.82,-0.16,-4.02%,303781879.00,France,2019,10561,Health Care,Biotechnology: Pharmaceutical Preparations
IPSC,Century Therapeutics Inc. Common Stock,$11.92,0.28,2.405%,674136470.00,United States,2021,205482,Consumer Durables,Specialty Chemicals
IPVI,InterPrivate IV InfraTech Partners Inc. Class A Common Stock,$9.74,0.00,0.00%,350031250.00,United States,2021,12,,
IPWR,Ideal Power Inc. Common Stock,$9.02,0.23,2.617%,53146255.00,United States,2013,25936,Capital Goods,Industrial Machinery/Components
IQ,iQIYI Inc. American Depositary Shares,$4.03,0.09,2.284%,3180818179.00,China,2018,8551597,Technology,Internet and Information Services
IQMD,Intelligent Medicine Acquisition Corp. Class A Common Stock,$9.90,-0.01,-0.101%,280665000.00,United States,2021,3970,,
IQMDU,Intelligent Medicine Acquisition Corp. Unit,$10.09,0.00,0.00%,286051500.00,United States,2021,1225,,
IRBT,iRobot Corporation Common Stock,$64.79,3.28,5.332%,1746627350.00,United States,2005,454047,,
IRCP,IRSA Propiedades Comerciales S.A. American Depositary Shares,$2.32,0.03,1.31%,313913409.00,Argentina,,25020,Consumer Services,Building operators
IRDM,Iridium Communications Inc Common Stock,$32.04,-0.22,-0.682%,4235764640.00,United States,,3250789,Consumer Services,Telecommunications Equipment
IREN,Iris Energy Limited Ordinary Shares,$13.15,0.65,5.20%,723724820.00,Australia,2021,85676,,
IRIX,IRIDEX Corporation Common Stock,$5.12,-0.28,-5.185%,81232558.00,United States,1996,50560,Health Care,Biotechnology: Electromedical & Electrotherapeutic Apparatus
IRMD,iRadimed Corporation Common Stock,$48.60,9.30,23.664%,599809050.00,United States,2014,201722,Health Care,Medical/Dental Instruments
IROQ,IF Bancorp Inc. Common Stock,$25.50,0.00,0.00%,83075838.00,United States,2011,39,Finance,Finance: Consumer Services
IRTC,iRhythm Technologies Inc. Common Stock,$124.35,2.61,2.144%,3659110292.00,United States,2016,192621,Health Care,Medical/Dental Instruments
IRWD,Ironwood Pharmaceuticals Inc. Class A Common Stock,$11.05,-0.21,-1.865%,1808337881.00,United States,2010,1872003,Health Care,Biotechnology: Pharmaceutical Preparations
ISAA,Iron Spark I Inc. Class A Common Stock,$9.9796,0.0296,0.297%,219958368.00,United States,2021,100,,
ISBC,Investors Bancorp Inc. Common Stock,$17.13,0.39,2.33%,4248193167.00,United States,,1198481,Finance,Savings Institutions
ISEE,IVERIC bio Inc. Common Stock,$13.90,0.27,1.981%,1593513778.00,United States,2013,607802,Health Care,Biotechnology: Pharmaceutical Preparations
ISLE,Isleworth Healthcare Acquisition Corporation Common stock,$9.84,-0.01,-0.102%,257721900.00,United States,2021,159,,
ISO,IsoPlexis Corporation Common Stock,$5.60,0.07,1.266%,218147703.00,United States,2021,85757,Health Care,Biotechnology: Electromedical & Electrotherapeutic Apparatus
ISRG,Intuitive Surgical Inc. Common Stock,$285.73,0.13,0.046%,102073288294.00,United States,2000,1633933,Health Care,Medical/Dental Instruments
ISSC,Innovative Solutions and Support Inc. Common Stock,$6.97,-0.06,-0.853%,120384223.00,United States,2000,5838,Capital Goods,Military/Government/Technical
ISTR,Investar Holding Corporation Common Stock,$19.685,0.085,0.434%,203611679.00,United States,2014,3514,Finance,Commercial Banks
ISUN,iSun Inc. Common Stock,$5.22,0.11,2.153%,61771027.00,United States,2016,35749,Technology,Semiconductors
ITCI,Intra-Cellular Therapies Inc. Common Stock,$48.72,2.42,5.227%,4502489688.00,United States,,1142879,Health Care,Biotechnology: Pharmaceutical Preparations
ITHX,ITHAX Acquisition Corp. Class A Ordinary Shares,$9.835,-0.005,-0.051%,303532688.00,United States,2021,66203,Finance,Business Services
ITI,Iteris Inc. Common Stock,$3.38,-0.32,-8.649%,143081389.00,United States,,1255994,Capital Goods,Telecommunications Equipment
ITIC,Investors Title Company Common Stock,$196.25,0.25,0.128%,371721443.00,United States,,1527,Finance,Specialty Insurers
ITOS,iTeos Therapeutics Inc. Common Stock,$36.12,0.97,2.76%,1274093015.00,United States,2020,311488,Consumer Durables,Specialty Chemicals
ITQ,Itiquira Acquisition Corp. Class A Ordinary Shares,$9.73,0.04,0.413%,279737500.00,United States,2021,8780,Finance,Business Services
ITRI,Itron Inc. Common Stock,$57.91,-0.35,-0.601%,2621716055.00,United States,1993,285658,Capital Goods,Electrical Products
ITRM,Iterum Therapeutics plc Ordinary Share,$0.4056,-0.0044,-1.073%,74133654.00,Ireland,2018,1723332,Health Care,Biotechnology: Pharmaceutical Preparations
ITRN,Ituran Location and Control Ltd. Ordinary Shares,$23.69,0.19,0.809%,490084340.00,Israel,2005,23626,Technology,Electronic Components
IVA,Inventiva S.A. American Depository Shares,$13.18,0.00,0.00%,536988720.00,France,2020,50,Consumer Services,Other Consumer Services
IVAC,Intevac Inc. Common Stock,$5.43,0.12,2.26%,133528609.00,United States,1995,63258,,
IXAQ,IX Acquisition Corp. Class A Ordinary Share,$9.72,0.02,0.206%,279450000.00,United Kingdom,2021,343,,
IZEA,IZEA Worldwide Inc. Common Stock,$1.20,0.07,6.195%,74400000.00,United States,,774597,Technology,Advertising
JACK,Jack In The Box Inc. Common Stock,$91.76,0.74,0.813%,1936351452.00,United States,,305879,Consumer Services,Restaurants
JAKK,JAKKS Pacific Inc. Common Stock,$9.85,0.20,2.073%,93609820.00,United States,1996,107715,Consumer Non-Durables,Recreational Products/Toys
JAMF,Jamf Holding Corp. Common Stock,$33.64,1.41,4.375%,4004676323.00,United States,2020,467178,Technology,Computer Software: Prepackaged Software
JANX,Janux Therapeutics Inc. Common Stock,$15.32,0.91,6.315%,637488333.00,United States,2021,34818,Health Care,Biotechnology: Pharmaceutical Preparations
JAQC,Jupiter Acquisition Corporation Common stock,$9.61,0.01,0.104%,195059446.00,United States,2021,200,,
JAZZ,Jazz Pharmaceuticals plc Common Stock (Ireland),$140.94,1.33,0.953%,8663531766.00,Ireland,2007,408440,Health Care,Biotechnology: Pharmaceutical Preparations
JBHT,J.B. Hunt Transport Services Inc. Common Stock,$189.60,-3.71,-1.919%,19925822400.00,United States,,520182,Transportation,Trucking Freight/Courier Services
JBLU,JetBlue Airways Corporation Common Stock,$14.48,0.06,0.416%,4605081930.00,United States,2002,7836989,Transportation,Air Freight/Delivery Services
JBSS,John B. Sanfilippo & Son Inc. Common Stock,$79.52,-0.07,-0.088%,916527481.00,United States,1991,47315,Consumer Non-Durables,Specialty Foods
JCIC,Jack Creek Investment Corp. Class A Ordinary Shares,$9.72,0.01,0.103%,419175000.00,United States,2021,6206,Finance,Business Services
JD,JD.com Inc. American Depositary Shares,$73.77,1.92,2.672%,114584691015.00,China,2014,6079247,Miscellaneous,Diversified Commercial Services
JFIN,Jiayin Group Inc. American Depositary Shares,$2.10,0.08,3.96%,113452500.00,China,2019,7537,Finance,Finance: Consumer Services
JFU,9F Inc. American Depositary Shares,$1.04,0.01,0.971%,240576622.00,China,2019,23421,Finance,Finance: Consumer Services
JG,Aurora Mobile Limited American Depositary Shares,$0.93,0.0331,3.69%,110135955.00,China,2018,52512,Technology,EDP Services
JJSF,J & J Snack Foods Corp. Common Stock,$150.08,0.42,0.281%,2864877120.00,United States,1986,122349,Consumer Non-Durables,Specialty Foods
JKHY,Jack Henry & Associates Inc. Common Stock,$168.00,1.00,0.599%,12438893376.00,United States,1985,669543,Technology,Retail: Computer Software & Peripheral Equipment
JMAC,Maxpro Capital Acquisition Corp. Class A Common Stock,$9.96,0.01,0.101%,136606629.00,Taiwan,2021,3789,,
JNCE,Jounce Therapeutics Inc. Common Stock,$7.60,0.48,6.742%,389451276.00,United States,2017,366187,Health Care,Biotechnology: Pharmaceutical Preparations
JOAN,JOANN Inc. Common Stock,$11.43,0.31,2.788%,470698476.00,United States,2021,433355,Consumer Non-Durables,Department/Specialty Retail Stores
JOBS,51job Inc. American Depositary Shares,$48.18,0.08,0.166%,3249124730.00,China,2004,158458,Technology,Diversified Commercial Services
JOFF,JOFF Fintech Acquisition Corp. Class A Common Stock,$9.7336,0.0036,0.037%,503713800.00,United States,2021,5720,,
JOUT,Johnson Outdoors Inc. Class A Common Stock,$84.76,-0.42,-0.493%,864597601.00,United States,,44900,Consumer Non-Durables,Recreational Products/Toys
JRSH,Jerash Holdings (US) Inc. Common Stock,$6.2425,0.0825,1.339%,76996980.00,United States,2018,20757,Basic Industries,Industrial Specialties
JRVR,James River Group Holdings Ltd. Common Shares,$28.15,-0.04,-0.142%,1049745844.00,Bermuda,2014,140270,Finance,Property-Casualty Insurers
JSPR,Jasper Therapeutics Inc. Common Stock,$4.83,0.27,5.921%,182831130.00,United States,2020,89852,Health Care,Biotechnology: Pharmaceutical Preparations
JUGG,Jaws Juggernaut Acquisition Corporation Class A Ordinary Share,$9.75,0.00,0.00%,336375000.00,United States,2021,8,,
JWEL,Jowell Global Ltd. Ordinary Shares,$3.13,0.02,0.643%,79723773.00,China,2021,162934,Consumer Services,Other Consumer Services
JYAC,Jiya Acquisition Corp. Class A Common Stock,$9.795,0.035,0.359%,131714256.00,United States,2020,688,,
JYNT,The Joint Corp. Common Stock,$50.07,0.69,1.397%,721675884.00,United States,2014,87161,,
KAII,Kismet Acquisition Two Corp. Class A Ordinary Shares,$9.74,0.04,0.412%,284895000.00,United States,2021,204,Finance,Business Services
KAIR,Kairos Acquisition Corp. Class A Ordinary Shares,$9.765,0.00,0.00%,336892500.00,United States,2021,67,Finance,Business Services
KALU,Kaiser Aluminum Corporation Common Stock,$94.02,0.27,0.288%,1491408421.00,United States,,66104,Basic Industries,Aluminum
KALV,KalVista Pharmaceuticals Inc. Common Stock,$13.19,0.82,6.629%,322756675.00,United Kingdom,2015,297630,Health Care,Biotechnology: Pharmaceutical Preparations
KARO,Karooooo Ltd. Ordinary Shares,$35.00,1.30,3.858%,1083288710.00,Singapore,2021,6794,Technology,Computer Software: Prepackaged Software
KBAL,Kimball International Inc. Class B Common Stock,$9.29,-0.39,-4.029%,339696951.00,United States,,446275,Consumer Durables,Industrial Specialties
KC,Kingsoft Cloud Holdings Limited American Depositary Shares,$7.52,0.12,1.622%,1817351880.00,China,2020,1273966,Technology,Computer Software: Prepackaged Software
KDNY,Chinook Therapeutics Inc. Common Stock,$12.61,0.11,0.88%,688648077.00,United States,2015,181391,Health Care,Biotechnology: Pharmaceutical Preparations
KDP,Keurig Dr Pepper Inc. Common Stock,$38.24,-0.51,-1.316%,54222851355.00,United States,,5495916,Consumer Non-Durables,Beverages (Production/Distribution)
KE,Kimball Electronics Inc. Common Stock,$19.26,-0.02,-0.104%,483443546.00,United States,,48221,Capital Goods,Industrial Machinery/Components
KELYA,Kelly Services Inc. Class A Common Stock,$16.99,0.06,0.354%,669298521.00,United States,,163393,Technology,Diversified Commercial Services
KELYB,Kelly Services Inc. Class B Common Stock,$16.99,0.00,0.00%,669298521.00,United States,,54,Technology,Diversified Commercial Services
KFFB,Kentucky First Federal Bancorp Common Stock,$7.59,-0.0398,-0.522%,62376252.00,United States,,2264,Finance,Savings Institutions
KFRC,Kforce Inc. Common Stock,$68.16,-0.53,-0.772%,1460269314.00,United States,1995,61859,Technology,Diversified Commercial Services
KHC,The Kraft Heinz Company Common Stock,$34.75,-1.09,-3.041%,42535475520.00,United States,,12947966,Consumer Non-Durables,Farming/Seeds/Milling
KIDS,OrthoPediatrics Corp. Common Stock,$45.06,0.79,1.785%,886707803.00,United States,2017,101006,Health Care,Medical/Dental Instruments
KIII,Kismet Acquisition Three Corp. Class A Ordinary Shares,$9.70,-0.01,-0.103%,353443750.00,United States,2021,249,Finance,Business Services
KINS,Kingstone Companies Inc. Common Stock,$5.1099,-0.0201,-0.392%,53567756.00,United States,,5355,Finance,Specialty Insurers
KINZ,KINS Technology Group Inc. Class A Common Stock,$10.00,0.00,0.00%,345000000.00,United States,2021,6029,,
KIRK,Kirkland's Inc. COMMONSTOCK,$16.41,0.24,1.484%,211612726.00,United States,2002,138624,Miscellaneous,Diversified Commercial Services
KLAC,KLA Corporation Common Stock,$377.38,3.70,0.99%,56876956141.00,United States,1980,1129207,Capital Goods,Electronic Components
KLAQ,KL Acquisition Corp Class A Common Stock,$9.72,-0.03,-0.308%,349312500.00,United States,2021,33359,,
KLDO,Kaleido Biosciences Inc. Common Stock,$1.70,0.05,3.03%,72410395.00,United States,2019,110711,Health Care,Biotechnology: Biological Products (No Diagnostic Substances)
KLIC,Kulicke and Soffa Industries Inc. Common Stock,$50.49,-2.51,-4.736%,3153736876.00,Singapore,,2167559,Technology,Semiconductors
KLTR,Kaltura Inc. Common Stock,$3.37,0.08,2.432%,427566873.00,United States,2021,420645,Technology,EDP Services
KLXE,KLX Energy Services Holdings Inc. Common Stock,$5.58,0.27,5.085%,57735367.00,United States,,398134,Energy,Oilfield Services/Equipment
KMDA,Kamada Ltd. Ordinary Shares,$6.11,0.03,0.493%,273644360.00,Israel,2013,29441,Health Care,Biotechnology: Pharmaceutical Preparations
KMPH,KemPharm Inc. Common Stock,$6.55,0.04,0.614%,229286942.00,United States,,358039,Health Care,Biotechnology: Pharmaceutical Preparations
KNBE,KnowBe4 Inc. Class A Common Stock,$23.78,0.75,3.257%,4076218428.00,United States,2021,484757,Technology,Computer Software: Prepackaged Software
KNDI,Kandi Technologies Group Inc Common Stock,$2.94,0.08,2.797%,227512282.00,China,,300216,Capital Goods,Auto Parts:O.E.M.
KNSA,Kiniksa Pharmaceuticals Ltd. Class A Common Stock,$10.30,-0.15,-1.435%,709550881.00,United States,2018,428308,Health Care,Biotechnology: Pharmaceutical Preparations
KNTE,Kinnate Biopharma Inc. Common Stock,$9.95,0.51,5.403%,434776145.00,United States,2020,150450,Health Care,Biotechnology: Pharmaceutical Preparations
KOD,Kodiak Sciences Inc Common Stock,$63.78,1.85,2.987%,3298528501.00,United States,2018,546340,Health Care,Biotechnology: Pharmaceutical Preparations
KOPN,Kopin Corporation Common Stock,$2.77,0.10,3.745%,255366871.00,United States,1992,1019854,Capital Goods,Industrial Machinery/Components
KOSS,Koss Corporation Common Stock,$8.59,0.57,7.107%,78493659.00,United States,,80844,Consumer Non-Durables,Consumer Electronics/Appliances
KPLT,Katapult Holdings Inc. Common Stock,$2.41,0.04,1.688%,234908414.00,United States,2019,450552,Technology,EDP Services
KPTI,Karyopharm Therapeutics Inc. Common Stock,$9.74,0.70,7.743%,735832631.00,United States,2013,3276399,Miscellaneous,Diversified Commercial Services
KRMD,Repro Med Systems Inc. Common Stock,$3.01,0.04,1.347%,134317217.00,United States,,23743,Health Care,Medical/Dental Instruments
KRNL,Kernel Group Holdings Inc. Class A Ordinary Shares,$9.71,0.01,0.103%,369890313.00,United States,2021,1951,Finance,Business Services
KRNT,Kornit Digital Ltd. Ordinary Shares,$99.10,2.54,2.63%,4611788556.00,Israel,2015,491126,Capital Goods,Industrial Machinery/Components
KRNY,Kearny Financial Corp Common Stock,$13.31,0.16,1.217%,977659430.00,United States,,372281,Finance,Savings Institutions
KRON,Kronos Bio Inc. Common Stock,$7.62,-0.05,-0.652%,429366319.00,United States,2020,335520,Consumer Durables,Specialty Chemicals
KROS,Keros Therapeutics Inc. Common Stock,$47.65,4.23,9.742%,1114946006.00,United States,2020,150814,Consumer Durables,Specialty Chemicals
KRT,Karat Packaging Inc. Common Stock,$16.25,-0.08,-0.49%,321740640.00,United States,2021,8459,Capital Goods,Office Equipment/Supplies/Services
KRTX,Karuna Therapeutics Inc. Common Stock,$108.86,3.62,3.44%,3224820197.00,United States,2019,98524,Health Care,Biotechnology: Pharmaceutical Preparations
KRUS,Kura Sushi USA Inc. Class A Common Stock,$45.43,2.21,5.113%,441201123.00,United States,2019,55108,Consumer Services,Restaurants
KRYS,Krystal Biotech Inc. Common Stock,$56.89,1.49,2.69%,1416913775.00,United States,2017,106260,Health Care,Biotechnology: Biological Products (No Diagnostic Substances)
KSCP,Knightscope Inc. Class A Common Stock,$9.01,0.13,1.464%,127842890.00,United States,2022,3288869,Miscellaneous,Diversified Manufacture
KSI,Kadem Sustainable Impact Corporation Class A common stock,$9.67,-0.01,-0.103%,211531250.00,United States,2021,18268,,
KTCC,Key Tronic Corporation Common Stock,$6.00,0.00,0.00%,64571226.00,United States,1983,8234,Technology,Computer peripheral equipment
KTOS,Kratos Defense & Security Solutions Inc. Common Stock,$16.48,0.18,1.104%,2043294966.00,United States,,708123,Consumer Non-Durables,Ordnance And Accessories
KURA,Kura Oncology Inc. Common Stock,$12.65,0.15,1.20%,841930554.00,United States,,1681709,Health Care,Biotechnology: Biological Products (No Diagnostic Substances)
KVHI,KVH Industries Inc. Common Stock,$8.60,-0.11,-1.263%,162532105.00,United States,1996,106477,Technology,Radio And Television Broadcasting And Communications Equipment
KVSA,Khosla Ventures Acquisition Co. Class A Common Stock,$9.73,-0.03,-0.307%,393967700.00,United States,2021,46560,,
KVSC,Khosla Ventures Acquisition Co. III Class A Common Stock,$9.72,-0.01,-0.103%,658596358.00,United States,2021,27629,,
KXIN,Kaixin Auto Holdings Ordinary Shares,$0.9801,0.01,1.031%,140605631.00,China,2017,437157,Finance,Business Services
KYMR,Kymera Therapeutics Inc. Common Stock,$39.73,0.39,0.991%,2041610913.00,United States,2020,533713,Consumer Durables,Specialty Chemicals
KZIA,Kazia Therapeutics Limited American Depositary Shares,$6.58,-0.31,-4.499%,86880478.00,Australia,,6591,Health Care,Biotechnology: Pharmaceutical Preparations
KZR,Kezar Life Sciences Inc. Common Stock,$12.81,0.48,3.893%,721203000.00,United States,2018,350385,Health Care,Biotechnology: Pharmaceutical Preparations
LAAA,Lakeshore Acquisition I Corp. Ordinary Shares,$9.89,-0.02,-0.202%,70173753.00,China,2021,400,,
LABP,Landos Biopharma Inc. Common Stock,$2.61,-0.24,-8.421%,105015052.00,United States,2021,71666,Consumer Durables,Specialty Chemicals
LAKE,Lakeland Industries Inc. Common Stock,$21.20,0.20,0.952%,164838607.00,United States,1986,35441,,
LAMR,Lamar Advertising Company Class A Common Stock,$110.09,-0.39,-0.353%,11145454353.00,United States,1996,373657,Consumer Services,Real Estate Investment Trusts
LANC,Lancaster Colony Corporation Common Stock,$153.73,-0.97,-0.627%,4232186900.00,United States,,90376,Consumer Non-Durables,Packaged Foods
LAND,Gladstone Land Corporation Common Stock,$29.89,-0.95,-3.08%,1022537289.00,United States,1993,260717,Consumer Services,Real Estate Investment Trusts
LANDM,Gladstone Land Corporation 5.00% Series D Cumulative Term Preferred Stock,$25.61,-0.01,-0.039%,617262618.00,United States,,25402,Consumer Services,Real Estate Investment Trusts
LARK,Landmark Bancorp Inc. Common Stock,$28.35,0.30,1.07%,141690011.00,United States,,3625,Finance,Major Banks
LASR,nLIGHT Inc. Common Stock,$19.17,0.38,2.022%,841958535.00,United States,2018,136226,Technology,Semiconductors
LAUR,Laureate Education Inc. Common Stock,$12.55,0.30,2.449%,2273957303.00,United States,2017,882020,Miscellaneous,Service to the Health Industry
LAWS,Lawson Products Inc. Common Stock,$46.75,0.08,0.171%,424412722.00,United States,,9207,Capital Goods,Industrial Machinery/Components
LAX,8i Acquisition 2 Corp. Ordinary Shares,$9.78,0.01,0.102%,108298830.00,Singapore,2021,6959,,
LAZR,Luminar Technologies Inc.  Class A Common Stock,$14.80,0.84,6.017%,5207446156.00,United States,2019,4823366,Technology,EDP Services
LAZY,Lazydays Holdings Inc. Common Stock,$16.37,0.65,4.135%,204800503.00,United States,,301791,Consumer Services,Other Specialty Stores
LBAI,Lakeland Bancorp Inc. Common Stock,$18.71,0.175,0.944%,1210656089.00,United States,,132196,Finance,Major Banks
LBC,Luther Burbank Corporation Common Stock,$12.77,0.00,0.00%,660058174.00,United States,2017,29211,Finance,Commercial Banks
LBPH,Longboard Pharmaceuticals Inc. Common Stock,$4.06,-0.04,-0.976%,69894321.00,United States,2021,85832,Health Care,Biotechnology: Pharmaceutical Preparations
LBPS,4D pharma plc American Depositary Shares,$3.89,-0.16,-3.951%,87671342.00,United Kingdom,,20086,Health Care,Biotechnology: Pharmaceutical Preparations
LBRDA,Liberty Broadband Corporation Class A Common Stock,$149.35,0.42,0.282%,26372263175.00,United States,,89819,Consumer Services,Telecommunications Equipment
LBRDK,Liberty Broadband Corporation Class C Common Stock,$152.97,-0.03,-0.02%,27011483749.00,United States,,1039442,Consumer Services,Telecommunications Equipment
LBTYA,Liberty Global plc Class A Ordinary Shares,$27.66,-0.07,-0.252%,15017188968.00,United Kingdom,,535176,Consumer Services,Television Services
LBTYB,Liberty Global plc Class B Ordinary Shares,$27.67,-0.0801,-0.289%,15022618176.00,United Kingdom,,680,Consumer Services,Television Services
LBTYK,Liberty Global plc Class C Ordinary Shares,$27.69,-0.06,-0.216%,15033476592.00,United Kingdom,,2384647,Consumer Services,Television Services
LCA,Landcadia Holdings IV Inc. Class A Common Stock,$9.71,-0.01,-0.103%,606875000.00,United States,2021,475,,
LCAA,L Catterton Asia Acquisition Corp Class A Ordinary Shares,$9.69,-0.01,-0.103%,347033706.00,Singapore,2021,129,Finance,Business Services
LCAP,Lionheart Acquisition Corp. II Class A Common Stock,$10.02,-0.03,-0.299%,294588000.00,United States,2020,252,,
LCID,Lucid Group Inc. Common Stock,$27.55,0.60,2.226%,45357409335.00,United States,,20359304,Capital Goods,Auto Manufacturing
LCNB,LCNB Corporation Common Stock,$20.13,0.58,2.967%,249913064.00,United States,,3540,Finance,Major Banks
LCUT,Lifetime Brands Inc. Common Stock,$14.15,0.20,1.434%,311557431.00,United States,1991,19453,Consumer Durables,Home Furnishings
LDHA,LDH Growth Corp I Class A Ordinary Shares,$9.73,-0.02,-0.205%,279737500.00,United States,2021,2204,Finance,Business Services
LE,Lands' End Inc. Common Stock,$17.29,0.06,0.348%,570282104.00,United States,,111638,Consumer Services,Clothing/Shoe/Accessory Stores
LECO,Lincoln Electric Holdings Inc. Common Shares,$126.65,-1.19,-0.931%,7478465295.00,United States,,131063,Capital Goods,Industrial Machinery/Components
LEE,Lee Enterprises Incorporated Common Stock,$33.99,-0.07,-0.206%,199663684.00,United States,,67723,Consumer Services,Newspapers/Magazines
LEGA,Lead Edge Growth Opportunities Ltd Class A Ordinary Shares,$9.68,-0.04,-0.412%,417450000.00,United States,2021,1567,Finance,Business Services
LEGH,Legacy Housing Corporation Common Stock (TX),$26.16,0.47,1.83%,633321985.00,United States,2018,63160,Basic Industries,Homebuilding
LEGN,Legend Biotech Corporation American Depositary Shares,$41.47,0.53,1.295%,6337898335.00,United States,2020,173556,Health Care,Biotechnology: Pharmaceutical Preparations
LESL,Leslie's Inc. Common Stock,$19.64,-0.39,-1.947%,3585074150.00,United States,2020,5491556,Consumer Services,
LEVL,Level One Bancorp Inc. Common Stock,$40.47,0.28,0.697%,312983891.00,United States,2018,24406,,
LFMD,LifeMD Inc. Common Stock,$3.51,0.25,7.669%,107382374.00,United States,,190138,Miscellaneous,Diversified Commercial Services
LFST,LifeStance Health Group Inc. Common Stock,$7.20,0.19,2.71%,2693870266.00,United States,2021,680767,Health Care,Hospital/Nursing Management
LFTR,Lefteris Acquisition Corp. Class A Common Stock,$9.82,0.02,0.204%,254213944.00,United States,2020,4463,,
LFUS,Littelfuse Inc. Common Stock,$254.18,-2.84,-1.105%,6260968623.00,United States,,112465,Technology,Electronic Components
LFVN,Lifevantage Corporation Common Stock (Delaware),$4.92,0.06,1.235%,63225685.00,United States,,123783,Consumer Non-Durables,Farming/Seeds/Milling
LGAC,Lazard Growth Acquisition Corp. I Ordinary Shares,$9.70,-0.04,-0.411%,697187500.00,,2021,7995,Finance,Business Services
LGIH,LGI Homes Inc. Common Stock,$118.77,-5.88,-4.717%,2882926895.00,United States,2013,286004,Capital Goods,Homebuilding
LGND,Ligand Pharmaceuticals Incorporated Common Stock,$118.93,-0.50,-0.419%,1987515464.00,United States,,100132,Health Care,Biotechnology: Pharmaceutical Preparations
LGO,Largo Inc. Common Shares,$8.23,0.20,2.491%,532694980.00,Canada,,89188,,
LGST,Semper Paratus Acquisition Corporation Class A Ordinary Shares,$9.95,0.01,0.101%,476936663.00,United States,2022,11436,,
LGTO,Legato Merger Corp. II Common Stock,$9.85,0.00,0.00%,353723350.00,United States,2021,80,,
LGVC,LAMF Global Ventures Corp. I Class A Ordinary Shares,$9.82,-0.06,-0.607%,342122250.00,United States,2021,100,,
