Symbol,Name,Last Sale,Net Change,% Change,Market Cap,Country,IPO Year,Volume,Sector,Industry
CTBI,Community Trust Bancorp Inc. Common Stock,$43.67,-0.05,-0.114%,779207347.00,United States,,42386,Finance,Major Banks
CTG,Computer Task Group Inc. Common Stock,$8.60,0.05,0.585%,131947409.00,United States,,3618,Technology,EDP Services
CTHR,Charles & Colvard Ltd Common Stock,$1.90,-0.34,-15.179%,57788409.00,United States,1997,449052,Consumer Non-Durables,Consumer Specialties
CTIC,CTI BioPharma Corp. (DE) Common Stock,$2.03,0.03,1.50%,196285621.00,United States,1997,631223,Health Care,Biotechnology: Pharmaceutical Preparations
CTKB,Cytek Biosciences Inc. Common Stock,$14.18,0.74,5.506%,1896233375.00,United States,2021,699288,Health Care,Biotechnology: Electromedical & Electrotherapeutic Apparatus
CTLP,Cantaloupe Inc. Common Stock,$7.90,0.45,6.04%,560648496.00,United States,,210079,Technology,EDP Services
CTMX,CytomX Therapeutics Inc. Common Stock,$4.26,0.13,3.148%,277961234.00,United States,2015,749194,Health Care,Biotechnology: Pharmaceutical Preparations
CTRE,CareTrust REIT Inc. Common Stock,$19.59,-0.42,-2.099%,1900873453.00,United States,,889525,Consumer Services,Real Estate Investment Trusts
CTRM,Castor Maritime Inc. Common Shares,$1.21,0.02,1.681%,114478206.00,Cyprus,,585684,Transportation,Marine Transportation
CTRN,Citi Trends Inc. Common Stock,$44.50,1.16,2.677%,378033241.00,United States,2005,520822,,
CTSH,Cognizant Technology Solutions Corporation Class A Common Stock,$86.82,0.76,0.883%,45602355546.00,United States,1998,3105490,Technology,EDP Services
CTSO,Cytosorbents Corporation Common Stock,$3.64,-0.06,-1.622%,158251359.00,United States,,121519,Health Care,Medical/Dental Instruments
CTXR,Citius Pharmaceuticals Inc. Common Stock,$1.51,0.09,6.338%,220504741.00,United States,,951184,Health Care,Biotechnology: Pharmaceutical Preparations
CTXS,Citrix Systems Inc. Common Stock,$102.36,0.11,0.108%,12786142789.00,United States,1995,2342937,Technology,Computer Software: Prepackaged Software
CUE,Cue Biopharma Inc. Common Stock,$6.88,-0.01,-0.145%,218515308.00,United States,2018,346014,Health Care,Biotechnology: Pharmaceutical Preparations
CULL,Cullman Bancorp Inc. Common Stock,$11.96,-0.09,-0.747%,88574480.00,United States,2021,729,Finance,Savings Institutions
CURI,CuriosityStream Inc. Class A Common Stock,$4.03,0.17,4.404%,212059918.00,United States,2020,383683,Consumer Services,Broadcasting
CUTR,Cutera Inc. Common Stock,$37.01,1.85,5.262%,664577800.00,United States,2004,203436,Health Care,Biotechnology: Electromedical & Electrotherapeutic Apparatus
CVAC,CureVac N.V. Ordinary Shares,$18.19,0.05,0.276%,3400664265.00,Germany,2020,587579,Health Care,Biotechnology: Pharmaceutical Preparations
CVBF,CVB Financial Corporation Common Stock,$22.79,0.28,1.244%,3284529783.00,United States,,1070475,Finance,Major Banks
CVCO,Cavco Industries Inc. Common Stock When Issued,$290.72,13.44,4.847%,2668029017.00,United States,,108358,Basic Industries,Homebuilding
CVCY,Central Valley Community Bancorp Common Stock,$22.81,-0.03,-0.131%,271818809.00,United States,,18265,Finance,Major Banks
CVET,Covetrus Inc. Common Stock,$17.55,0.02,0.114%,2418097898.00,United States,,586136,Health Care,Managed Health Care
CVGI,Commercial Vehicle Group Inc. Common Stock,$7.50,-0.13,-1.704%,247338368.00,United States,2004,75207,Capital Goods,Auto Parts:O.E.M.
CVGW,Calavo Growers Inc. Common Stock,$41.66,-0.12,-0.287%,736464022.00,United States,,63878,,Farming/Seeds/Milling
CVLG,Covenant Logistics Group Inc. Class A Common Stock,$20.58,-0.83,-3.877%,344047035.00,United States,,96449,Transportation,Trucking Freight/Courier Services
CVLT,Commvault Systems Inc. Common Stock,$65.42,-0.33,-0.502%,2915088639.00,United States,2006,250779,Technology,Computer Software: Prepackaged Software
CVLY,Codorus Valley Bancorp Inc Common Stock,$21.54,0.05,0.233%,204026880.00,United States,,18076,Finance,Savings Institutions
CVRX,CVRx Inc. Common Stock,$8.03,0.24,3.081%,163424785.00,United States,2021,39240,Health Care,Biotechnology: Electromedical & Electrotherapeutic Apparatus
CVT,Cvent Holding Corp. Common Stock,$6.45,0.06,0.939%,3103234933.00,United States,1987,77175,Technology,Computer Software: Prepackaged Software
CWBC,Community West Bancshares Common Stock,$13.9102,0.0802,0.58%,120323230.00,United States,,267,Finance,Major Banks
CWCO,Consolidated Water Co. Ltd. Ordinary Shares,$9.90,0.00,0.00%,150585920.00,Cayman Islands,,44966,Public Utilities,Water Supply
CWST,Casella Waste Systems Inc. Class A Common Stock,$75.67,-1.14,-1.484%,3889284617.00,United States,1997,266413,Public Utilities,Environmental Services
CXDO,Crexendo Inc. Common Stock,$4.19,0.10,2.445%,90861047.00,United States,,13168,Consumer Services,Telecommunications Equipment
CYAD,Celyad Oncology SA American Depositary Shares,$3.58,0.02,0.562%,80886362.00,Belgium,2015,2300,Health Care,Biotechnology: Pharmaceutical Preparations
CYBE,CyberOptics Corporation Common Stock,$36.66,0.65,1.805%,269654426.00,United States,1987,27130,Capital Goods,Electronic Components
CYBR,CyberArk Software Ltd. Ordinary Shares,$135.68,3.91,2.967%,5394590940.00,Israel,2014,271216,Technology,Computer Software: Prepackaged Software
CYCN,Cyclerion Therapeutics Inc. Common Stock,$1.22,0.00,0.00%,52845209.00,United States,,67320,Health Care,Biotechnology: Pharmaceutical Preparations
CYRX,CryoPort Inc. Common Stock,$37.45,0.46,1.244%,1848820215.00,United States,,430964,,
CYT,Cyteir Therapeutics Inc. Common Stock,$5.91,0.39,7.065%,209042190.00,United States,2021,146643,Health Care,Biotechnology: Pharmaceutical Preparations
CYTK,Cytokinetics Incorporated Common Stock,$33.70,1.61,5.017%,2844082350.00,United States,2004,1896515,Health Care,Biotechnology: Pharmaceutical Preparations
CYXT,Cyxtera Technologies Inc. Class A Common Stock,$11.44,-0.22,-1.887%,1956999067.00,United States,2020,160126,Technology,EDP Services
CZNC,Citizens & Northern Corp Common Stock,$24.89,-0.14,-0.559%,392243750.00,United States,,15747,Finance,Major Banks
CZR,Caesars Entertainment Inc. Common Stock,$78.83,2.47,3.235%,16851808519.00,United States,,2309332,Consumer Services,Hotels/Resorts
CZWI,Citizens Community Bancorp Inc. Common Stock,$15.44,0.41,2.728%,162157704.00,United States,,10306,Finance,Savings Institutions
DADA,Dada Nexus Limited American Depositary Shares,$9.82,0.12,1.237%,2297213291.00,China,2020,799735,Consumer Services,Department/Specialty Retail Stores
DAKT,Daktronics Inc. Common Stock,$4.68,-0.03,-0.637%,212775999.00,United States,1994,173352,Capital Goods,Office Equipment/Supplies/Services
DALS,DA32 Life Science Tech Acquisition Corp. Class A Common Stock,$9.62,0.00,0.00%,246753000.00,United States,2021,202,,
DAOO,Crypto 1 Acquisition Corp Class A Ordinary Shares,$9.86,-0.04,-0.404%,283475000.00,United States,2022,183,,
DARE,Dare Bioscience Inc. Common Stock,$1.56,0.05,3.311%,119498533.00,United States,2014,1122846,Health Care,Biotechnology: Pharmaceutical Preparations
DAVE,Dave Inc. Class A Common Stock,$11.38,0.56,5.176%,4233368330.00,United States,,583679,Technology,Retail: Computer Software & Peripheral Equipment
DAWN,Day One Biopharmaceuticals Inc. Common Stock,$13.74,-0.35,-2.484%,850903622.00,United States,2021,273642,Health Care,Biotechnology: Pharmaceutical Preparations
DBTX,Decibel Therapeutics Inc. Common Stock,$4.24,0.21,5.211%,105675059.00,United States,2021,56152,Health Care,Biotechnology: Pharmaceutical Preparations
DBVT,DBV Technologies S.A. American Depositary Shares,$1.53,0.02,1.325%,168122921.00,France,2014,22223,Health Care,Biotechnology: Pharmaceutical Preparations
DBX,Dropbox Inc. Class A Common Stock,$24.26,0.30,1.252%,9278722588.00,United States,2018,4340208,Technology,Computer Software: Prepackaged Software
DCBO,Docebo Inc. Common Shares,$53.53,0.99,1.884%,1758818134.00,Canada,,73741,,
DCFC,Tritium DCFC Limited Ordinary Shares,$6.71,0.10,1.513%,1027297310.00,Australia,,148768,Technology,Electronic Components
DCGO,DocGo Inc. Common Stock,$7.19,0.23,3.305%,719499259.00,United States,2020,465139,Health Care,Managed Health Care
DCOM,Dime Community Bancshares Inc. Common Stock,$34.30,0.01,0.029%,1367815400.00,United States,,178469,Finance,Savings Institutions
DCPH,Deciphera Pharmaceuticals Inc. Common Stock,$7.97,0.10,1.271%,466092271.00,United States,2017,991877,Health Care,Biotechnology: Pharmaceutical Preparations
DCRD,Decarbonization Plus Acquisition Corporation IV Class A Ordinary Share,$9.88,-0.02,-0.202%,390568750.00,United States,2021,242,,
DCT,Duck Creek Technologies Inc. Common Stock,$25.34,0.38,1.522%,3347331518.00,United States,2020,426840,Technology,Retail: Computer Software & Peripheral Equipment
DCTH,Delcath Systems Inc. Common Stock,$7.39,0.40,5.722%,54362976.00,United States,,51627,Health Care,Medical Specialities
DDI,DoubleDown Interactive Co. Ltd. American Depository Shares,$14.05,0.0113,0.08%,696225832.00,South Korea,2021,7748,Technology,EDP Services
DDOG,Datadog Inc. Class A Common Stock,$150.26,12.24,8.868%,46883579456.00,United States,2019,5641667,Technology,EDP Services
DENN,Denny's Corporation Common Stock,$15.52,0.23,1.504%,983751667.00,United States,,359738,Consumer Services,Restaurants
DERM,Journey Medical Corporation Common Stock,$5.54,-0.015,-0.27%,92294439.00,United States,2021,64012,Health Care,Biotechnology: Pharmaceutical Preparations
DFH,Dream Finders Homes Inc. Class A Common Stock,$17.34,-0.32,-1.812%,1604322498.00,United States,2021,169143,,
DGHI,Digihost Technology Inc. Common Subordinate Voting Shares,$4.28,0.50,13.228%,107126731.00,Canada,,143620,,
DGICA,Donegal Group Inc. Class A Common Stock,$14.08,0.03,0.214%,441117206.00,United States,,46730,Finance,Property-Casualty Insurers
DGICB,Donegal Group Inc. Class B Common Stock,$13.55,0.49,3.752%,424512652.00,United States,1986,914,Finance,Property-Casualty Insurers
DGII,Digi International Inc. Common Stock,$20.31,-0.31,-1.503%,704843318.00,United States,1989,211856,Technology,Computer peripheral equipment
DGLY,Digital Ally Inc. Common Stock,$1.06,0.01,0.952%,55865124.00,United States,,203085,Miscellaneous,Diversified Manufacture
DGNU,Dragoneer Growth Opportunities Corp. III Class A Ordinary Shares,$9.72,0.00,0.00%,523271418.00,United States,2021,172908,Finance,Business Services
DH,Definitive Healthcare Corp. Class A Common Stock,$22.76,0.75,3.408%,2259233459.00,United States,2021,315969,Technology,Computer Software: Prepackaged Software
DHAC,Digital Health Acquisition Corp. Common Stock,$9.95,0.02,0.201%,148573400.00,United States,2021,3514,,
DHBC,DHB Capital Corp. Class A common stock,$9.70,0.00,0.00%,348593750.00,United States,2021,15,,
DHBCU,DHB Capital Corp. Unit,$9.83,-0.09,-0.907%,353265625.00,United States,2021,25080,,
DHC,Diversified Healthcare Trust Common Shares of Beneficial Interest,$3.10,-0.01,-0.322%,740884171.00,United States,,1545631,Consumer Services,Real Estate Investment Trusts
DHCA,DHC Acquisition Corp. Class A ordinary share,$9.73,0.00,0.00%,376369438.00,United States,2021,919,Finance,Business Services
DHHC,DiamondHead Holdings Corp. Class A Common Stock,$9.74,0.01,0.103%,420037500.00,United States,2021,10888,,
DHIL,Diamond Hill Investment Group Inc. Class A Common Stock,$181.82,1.37,0.759%,576677585.00,United States,,4801,Finance,Investment Managers
DIBS,1stdibs.com Inc. Common Stock,$9.63,0.24,2.556%,364743954.00,United States,2021,118682,Miscellaneous,Diversified Commercial Services
DICE,DICE Therapeutics Inc. Common Stock,$16.96,-0.53,-3.03%,648404798.00,United States,2021,160587,Health Care,Biotechnology: Pharmaceutical Preparations
DILA,DILA Capital Acquisition Corp. Class A Common Stock,$9.78,0.00,0.00%,74127266.00,Mexico,2021,3,,
DIOD,Diodes Incorporated Common Stock,$90.01,1.30,1.465%,4052049028.00,United States,,240210,Technology,Semiconductors
DISA,Disruptive Acquisition Corporation I Class A Ordinary Shares,$9.68,-0.06,-0.616%,332750000.00,United States,2021,115068,Finance,Business Services
DISCA,Discovery Inc. Series A Common Stock,$28.90,-0.03,-0.104%,14621776716.00,United States,,6722943,Consumer Services,Television Services
DISCB,Discovery Inc. Series B Common Stock,$30.50,-0.70,-2.244%,15431286846.00,United States,,3278,Consumer Services,Television Services
DISCK,Discovery Inc. Series C Common Stock,$28.62,0.01,0.035%,14480112443.00,United States,,4627825,Consumer Services,Television Services
DISH,DISH Network Corporation Class A Common Stock,$30.65,-0.18,-0.584%,16207769500.00,United States,1995,3643894,Consumer Services,Television Services
DJCO,Daily Journal Corp. (S.C.) Common Stock,$310.00,2.66,0.865%,428031260.00,United States,,1327,Consumer Services,Newspapers/Magazines
DKDCA,Data Knights Acquisition Corp. Class A Common Stock,$10.14,0.00,0.00%,151697189.00,United Kingdom,2021,32,,
DKNG,DraftKings Inc. Class A Common Stock,$21.89,1.34,6.521%,8898867471.00,United States,2019,20395158,Consumer Services,Services-Misc. Amusement & Recreation
DLCA,Deep Lake Capital Acquisition Corp. Class A Ordinary Shares,$9.75,-0.005,-0.051%,252281250.00,United States,2021,404,Finance,Business Services
DLHC,DLH Holdings Corp.,$16.08,0.25,1.579%,205307639.00,United States,,50487,Miscellaneous,Business Services
DLO,DLocal Limited Class A Common Shares,$30.44,2.04,7.183%,8980665744.00,Uruguay,2021,718200,,
DLPN,Dolphin Entertainment Inc. Common Stock,$5.34,0.12,2.299%,63284484.00,United States,,80942,,
DLTH,Duluth Holdings Inc. Class B Common Stock,$14.33,-0.10,-0.693%,473785883.00,United States,2015,59881,Consumer Services,Department/Specialty Retail Stores
DLTR,Dollar Tree Inc. Common Stock,$133.49,1.65,1.252%,30029384316.00,United States,1995,1695215,Consumer Services,Department/Specialty Retail Stores
DMAC,DiaMedica Therapeutics Inc. Common Stock,$2.77,0.08,2.974%,73236631.00,United States,2018,50007,,
DMAQ,Deep Medicine Acquisition Corp. Class A Common Stock,$9.89,0.00,0.00%,162524348.00,United States,2021,2,,
DMLP,Dorchester Minerals L.P. Common Units Representing Limited Partnership Interests,$23.79,-0.10,-0.419%,879867773.00,United States,,62011,Energy,Oil & Gas Production
DMRC,Digimarc Corporation Common Stock,$29.02,0.65,2.291%,513991967.00,United States,,64086,Technology,EDP Services
DMTK,DermTech Inc. Common Stock,$12.70,0.64,5.307%,377408415.00,United States,2017,522867,Health Care,Managed Health Care
DNAA,Social Capital Suvretta Holdings Corp. I Class A Ordinary Share,$9.84,-0.01,-0.102%,313797600.00,United States,2021,41148,,
DNAB,Social Capital Suvretta Holdings Corp. II Class A Ordinary Shares,$9.69,0.02,0.207%,309014100.00,United States,2021,8467,,
DNAC,Social Capital Suvretta Holdings Corp. III Class A ordinary shares,$9.86,0.01,0.102%,314435400.00,United States,2021,19839,,
DNAD,Social Capital Suvretta Holdings Corp. IV Class A Ordinary Shares,$9.6769,0.0093,0.096%,308596341.00,United States,2021,145373,Health Care,Biotechnology: Pharmaceutical Preparations
DNAY,Codex DNA Inc. Common Stock,$7.61,0.16,2.148%,223027784.00,United States,2021,106697,Health Care,Medical Specialities
DNLI,Denali Therapeutics Inc. Common Stock,$33.83,0.09,0.267%,4131508405.00,United States,2017,463480,Health Care,Biotechnology: Biological Products (No Diagnostic Substances)
DNUT,Krispy Kreme Inc. Common Stock,$14.45,0.21,1.475%,2416773121.00,United States,2021,946159,Consumer Services,Specialty Foods
DOCU,DocuSign Inc. Common Stock,$118.46,4.22,3.694%,23440452915.00,United States,2018,3660705,Technology,EDP Services
DOGZ,Dogness (International) Corporation Class A Common Stock,$3.81,0.03,0.794%,121169179.00,China,2017,390826,Consumer Durables,Miscellaneous manufacturing industries
DOMO,Domo Inc. Class B Common Stock,$46.84,2.83,6.43%,1527459473.00,United States,2018,215612,Technology,Computer Software: Prepackaged Software
DOOO,BRP Inc. (Recreational Products) Common Subordinate Voting Shares,$78.59,-1.38,-1.726%,6444742693.00,Canada,,71912,,
DORM,Dorman Products Inc. Common Stock,$91.53,-1.52,-1.634%,2894522295.00,United States,,63111,Capital Goods,Auto Parts:O.E.M.
DOX,Amdocs Limited Ordinary Shares,$77.17,0.09,0.117%,9617064923.00,Guernsey,,936564,Technology,EDP Services
DOYU,DouYu International Holdings Limited ADS,$2.30,0.21,10.048%,746142517.00,China,2019,3879499,Technology,Computer Software: Programming Data Processing
DPCS,DP Cap Acquisition Corp I Class A Ordinary Shares,$9.90,0.00,0.00%,284625000.00,United States,2021,1,,
DRAY,Macondray Capital Acquisition Corp. I Class A Ordinary Shares,$9.855,0.00,0.00%,354164063.00,United States,2021,2,,
DRIO,DarioHealth Corp. Common Stock,$8.38,0.26,3.202%,138903805.00,Israel,,95867,Health Care,Medical/Dental Instruments
DRRX,DURECT Corporation Common Stock,$0.7029,0.0063,0.904%,159913835.00,United States,2000,583320,Health Care,Biotechnology: Pharmaceutical Preparations
DRTT,DIRTT Environmental Solutions Ltd. Common Shares,$1.60,0.07,4.575%,136535288.00,Canada,,36218,,
DRVN,Driven Brands Holdings Inc. Common Stock,$28.06,0.23,0.826%,4696676767.00,United States,2021,486033,,
DSAC,Duddell Street Acquisition Corp. Class A Ordinary Shares,$9.91,0.00,0.00%,216781250.00,Hong Kong,2020,40665,Finance,Business Services
DSEY,Diversey Holdings Ltd. Ordinary Shares,$10.68,-0.19,-1.748%,3390164575.00,United States,2021,362405,Consumer Durables,Specialty Chemicals
DSGN,Design Therapeutics Inc. Common Stock,$12.74,0.17,1.352%,709140263.00,United States,2021,112572,Health Care,Biotechnology: Pharmaceutical Preparations
DSGX,Descartes Systems Group Inc. (The) Common Stock,$70.53,0.98,1.409%,5970900740.00,Canada,,174299,,
DSKE,Daseke Inc. Common Stock,$11.08,-0.05,-0.449%,692381145.00,United States,2015,755386,,
DSP,Viant Technology Inc. Class A Common Stock,$7.64,0.51,7.153%,103006682.00,United States,2021,90426,Technology,EDP Services
DSWL,Deswell Industries Inc. Common Shares,$3.87,-0.03,-0.769%,61669375.00,Macau,1995,2430,Consumer Non-Durables,Plastic Products
DTEA,DAVIDsTEA Inc. Common Stock,$3.06,0.01,0.328%,80661505.00,Canada,2015,11437,,
DTIL,Precision BioSciences Inc. Common Stock,$4.53,0.17,3.899%,275275901.00,United States,2019,546499,Health Care,Biotechnology: Pharmaceutical Preparations
DTOC,Digital Transformation Opportunities Corp. Class A Common Stock,$9.73,0.02,0.206%,405619375.00,United States,2021,118377,,
DTRT,DTRT Health Acquisition Corp. Class A Common Stock,$9.97,0.00,0.00%,286637500.00,United States,2021,2,,
DUNE,Dune Acquisition Corporation Class A Common Stock,$9.90,0.00,0.00%,213468750.00,United States,2021,1195,,
DUOL,Duolingo Inc. Class A Common Stock,$91.48,6.95,8.222%,3427967010.00,United States,2021,502652,Technology,Computer Software: Prepackaged Software
DVAX,Dynavax Technologies Corporation Common Stock,$12.62,0.25,2.021%,1513795906.00,United States,2004,1343001,Health Care,Biotechnology: Pharmaceutical Preparations
DWAC,Digital World Acquisition Corp. Class A Common Stock,$84.45,3.36,4.144%,3142784286.00,United States,2021,8868843,,
DWSN,Dawson Geophysical Company Common Stock,$2.34,0.00,0.00%,55326806.00,United States,,10652,Energy,Oil & Gas Production
DXCM,DexCom Inc. Common Stock,$420.35,1.62,0.387%,40741176992.00,United States,2005,821291,Health Care,Medical Specialities
DXLG,Destination XL Group Inc. Common Stock,$4.66,0.00,0.00%,294763854.00,United States,,175287,Consumer Services,Clothing/Shoe/Accessory Stores
DXPE,DXP Enterprises Inc. Common Stock,$28.51,-0.13,-0.454%,534579520.00,United States,,145489,Capital Goods,Industrial Machinery/Components
DXYN,Dixie Group Inc. (The) Common Stock,$4.14,0.42,11.29%,65402155.00,United States,,47299,Consumer Durables,Home Furnishings
DYAI,Dyadic International Inc. Common Stock,$3.65,0.03,0.829%,102488923.00,United States,,20980,Health Care,Biotechnology: Biological Products (No Diagnostic Substances)
DYN,Dyne Therapeutics Inc. Common Stock,$6.69,0.11,1.672%,344725458.00,United States,2020,130810,Consumer Durables,Specialty Chemicals
DYNS,Dynamics Special Purpose Corp. Class A Common Stock,$9.85,0.00,0.00%,290235175.00,United States,2021,60701,,
DZSI,DZS Inc. Common Stock,$14.22,0.24,1.717%,387332465.00,United States,,53075,Public Utilities,Telecommunications Equipment
EA,Electronic Arts Inc. Common Stock,$137.71,0.42,0.306%,38945509373.00,United States,,2396683,Technology,Computer Software: Prepackaged Software
EAC,Edify Acquisition Corp. Class A Common Stock,$9.74,0.00,0.00%,336030000.00,United States,2021,5,,
EAR,Eargo Inc. Common Stock,$5.07,0.25,5.187%,199062837.00,United States,2020,555898,Health Care,Medical Specialities
EBAC,European Biotech Acquisition Corp. Class A Ordinary Shares,$9.75,0.00,0.00%,159886116.00,Netherlands,2021,210,Finance,Business Services
EBAY,eBay Inc. Common Stock,$59.29,2.10,3.672%,37115764175.00,United States,1998,10586989,Consumer Services,Catalog/Specialty Distribution
EBC,Eastern Bankshares Inc. Common Stock,$20.98,0.28,1.353%,3908685865.00,United States,2020,672585,Finance,Major Banks
EBET,Esports Technologies Inc. Common Stock,$11.05,-0.13,-1.163%,156818716.00,United States,2021,40386,Consumer Services,Services-Misc. Amusement & Recreation
EBIX,Ebix Inc. Common Stock,$27.80,0.32,1.164%,860227604.00,United States,,366610,Technology,EDP Services
EBMT,Eagle Bancorp Montana Inc. Common Stock,$22.85,-0.25,-1.082%,155261431.00,United States,,5623,Finance,Savings Institutions
EBON,Ebang International Holdings Inc. Class A Ordinary Shares,$1.25,0.08,6.838%,232294171.00,China,2020,5016968,Technology,Semiconductors
EBTC,Enterprise Bancorp Inc Common Stock,$39.89,-0.01,-0.025%,480211058.00,United States,,9887,Finance,Major Banks
ECOL,US Ecology Inc Common Stock,$27.15,-0.36,-1.309%,855559597.00,United States,,295838,Public Utilities,Environmental Services
ECPG,Encore Capital Group Inc Common Stock,$66.15,0.09,0.136%,1936324940.00,United States,,253174,,
EDAP,EDAP TMS S.A. American Depositary Shares,$7.4473,0.1573,2.158%,248338679.00,France,1997,27425,Health Care,Biotechnology: Electromedical & Electrotherapeutic Apparatus
EDIT,Editas Medicine Inc. Common Stock,$18.73,0.76,4.229%,1281104654.00,United States,2016,1452638,Health Care,Biotechnology: Pharmaceutical Preparations
EDNC,Endurance Acquisition Corp. Class A Ordinary Shares,$9.78,0.01,0.102%,251835000.00,United States,2021,100,,
EDSA,Edesa Biotech Inc. Common Shares,$4.20,0.13,3.194%,56778956.00,United States,,35843,,
EDTX,EdtechX Holdings Acquisition Corp. II Class A common stock,$10.04,-0.01,-0.10%,144325000.00,United Kingdom,2021,302,,
EDTXU,EdtechX Holdings Acquisition Corp. II Unit,$10.18,0.0399,0.393%,146337500.00,United Kingdom,2020,510,,
EDUC,Educational Development Corporation Common Stock,$7.45,0.03,0.404%,64868990.00,United States,,12584,Consumer Services,Books
EEFT,Euronet Worldwide Inc. Common Stock,$136.42,-1.05,-0.764%,7210618658.00,United States,1997,511949,Technology,EDP Services
EFSC,Enterprise Financial Services Corporation Common Stock,$50.78,0.54,1.075%,1920499600.00,United States,,99702,Finance,Major Banks
EFTR,eFFECTOR Therapeutics Inc. Common Stock,$5.00,-0.22,-4.215%,204164570.00,United States,2021,17136,Health Care,Biotechnology: Pharmaceutical Preparations
EGAN,eGain Corporation Common Stock,$12.745,2.695,26.816%,400043884.00,United States,1999,1702791,Technology,Computer Software: Prepackaged Software
EGBN,Eagle Bancorp Inc. Common Stock,$59.97,0.35,0.587%,1916047017.00,United States,,84874,Finance,Major Banks
EGLE,Eagle Bulk Shipping Inc. Common Stock,$47.23,2.45,5.471%,641901088.00,United States,,165415,Transportation,Marine Transportation
EGLX,Enthusiast Gaming Holdings Inc. Common Stock,$2.23,0.11,5.189%,297894653.00,Canada,,294423,,
EGRX,Eagle Pharmaceuticals Inc. Common Stock,$44.58,-0.04,-0.09%,575700726.00,United States,2014,156135,Health Care,Biotechnology: Pharmaceutical Preparations
EH,EHang Holdings Limited ADS,$16.45,0.81,5.179%,911807593.00,China,2019,295777,Transportation,Air Freight/Delivery Services
EHTH,eHealth Inc. Common Stock,$19.00,0.31,1.659%,501374128.00,United States,2006,463759,Finance,Specialty Insurers
EIGR,Eiger BioPharmaceuticals Inc. Common Stock,$4.50,0.25,5.882%,152891100.00,United States,2014,226266,Health Care,Biotechnology: Biological Products (No Diagnostic Substances)
EJFA,EJF Acquisition Corp. Class A Ordinary Share,$9.92,-0.03,-0.302%,356500000.00,United States,2021,48850,Finance,Business Services
ELDN,Eledon Pharmaceuticals Inc. Common Stock,$3.79,0.06,1.609%,52138227.00,United States,2014,17603,Health Care,Biotechnology: Pharmaceutical Preparations
ELEV,Elevation Oncology Inc. Common stock,$3.875,-0.245,-5.947%,89999343.00,United States,2021,19193,Health Care,Biotechnology: Pharmaceutical Preparations
ELMS,Electric Last Mile Solutions Inc. Class A Common stock,$2.28,-0.08,-3.39%,282782955.00,United States,2021,2284401,Capital Goods,Auto Manufacturing
ELYM,Eliem Therapeutics Inc Common Stock,$8.76,0.38,4.535%,232615808.00,United States,2021,15808,Health Care,Biotechnology: Pharmaceutical Preparations
EM,Smart Share Global Limited American Depositary Shares,$1.61,-0.20,-11.05%,401592078.00,China,2021,90605,Consumer Services,Other Consumer Services
EMBK,Embark Technology Inc. Common Stock,$4.30,0.51,13.456%,1933078184.00,United States,,701746,Technology,Computer Software: Prepackaged Software
EMCF,Emclaire Financial Corp Common Stock,$29.0001,-0.0404,-0.139%,79321422.00,United States,,2526,Finance,Major Banks
EMKR,EMCORE Corporation Common Stock,$5.66,0.16,2.909%,210991171.00,United States,1997,318730,Technology,Semiconductors
EML,Eastern Company (The) Common Stock,$25.00,0.35,1.42%,156879500.00,United States,,975,Capital Goods,Industrial Specialties
ENCP,Energem Corp Class A Ordinary Shares,$9.94,0.02,0.202%,148136566.00,Malaysia,2022,19213,,
ENDP,Endo International plc Ordinary Shares,$3.08,0.01,0.326%,719706674.00,Ireland,,4788674,Health Care,Biotechnology: Pharmaceutical Preparations
