Symbol,Name,Last Sale,Net Change,% Change,Market Cap,Country,IPO Year,Volume,Sector,Industry
PGTI,PGT Innovations Inc.,$18.07,0.05,0.277%,1077472503.00,United States,2006,200127,Capital Goods,Building Products
PH,Parker-Hannifin Corporation Common Stock,$303.77,0.80,0.264%,39027650880.00,United States,,1107703,Capital Goods,Office Equipment/Supplies/Services
PHAR,Pharming Group N.V. ADS each representing 10 ordinary shares,$9.835,0.2611,2.727%,628281053.00,Netherlands,,1716,Health Care,Biotechnology: Pharmaceutical Preparations
PHAT,Phathom Pharmaceuticals Inc. Common Stock,$16.12,-0.30,-1.827%,510093575.00,United States,2019,45476,Health Care,Biotechnology: Pharmaceutical Preparations
PHG,Koninklijke Philips N.V. NY Registry Shares,$33.73,0.42,1.261%,29351238860.00,Netherlands,,2245166,Health Care,Biotechnology: Electromedical & Electrotherapeutic Apparatus
PHI,PLDT Inc. Sponsored ADR,$36.83,-0.17,-0.459%,7955280000.00,Philippines,,12165,Public Utilities,Telecommunications Equipment
PHK,Pimco High Income Fund Pimco High Income Fund,$6.00,0.03,0.503%,803424000.00,United States,2003,424496,Finance,Finance/Investors Services
PHM,PulteGroup Inc. Common Stock,$48.86,0.12,0.246%,12370651690.00,United States,,4119836,,
PHR,Phreesia Inc. Common Stock,$31.02,1.28,4.304%,1589460457.00,United States,2019,599829,Health Care,Managed Health Care
PHVS,Pharvaris N.V. Ordinary Shares,$18.31,1.12,6.515%,606584538.00,Netherlands,2021,976,Health Care,Biotechnology: Pharmaceutical Preparations
PI,Impinj Inc. Common Stock,$79.67,1.59,2.036%,1946411874.00,United States,2016,222560,Public Utilities,Telecommunications Equipment
PIAI,Prime Impact Acquisition I Class A Ordinary Shares,$9.87,0.02,0.203%,399838803.00,,2020,7220,Finance,Business Services
PICC,Pivotal Investment Corporation III Class A Common Stock,$9.74,0.04,0.412%,336030000.00,,2021,8251,,
PII,Polaris Inc. Common Stock,$116.40,1.25,1.086%,7063356980.00,United States,,702988,Consumer Non-Durables,Recreational Products/Toys
PIII,P3 Health Partners Inc. Class A Common Stock,$5.12,0.18,3.644%,1247251523.00,United States,2021,57918,,
PINC,Premier Inc. Class A Common Stock,$37.00,-0.30,-0.804%,4406067041.00,United States,2013,394665,Health Care,Managed Health Care
PING,Ping Identity Holding Corp. Common Stock,$19.62,0.41,2.134%,1639889651.00,United States,2019,509397,Technology,EDP Services
PINS,Pinterest Inc. Class A Common Stock,$26.46,-0.79,-2.899%,17414514107.00,,2019,22381150,,
PIPR,Piper Sandler Companies Common Stock,$150.38,-0.56,-0.371%,2688522964.00,United States,,39086,Finance,Investment Bankers/Brokers/Service
PJT,PJT Partners Inc. Class A Common Stock,$63.32,0.33,0.524%,1536631144.00,United States,2015,153180,Finance,Investment Managers
PK,Park Hotels & Resorts Inc. Common Stock ,$18.80,0.64,3.524%,4445808565.00,United States,2016,2767905,Consumer Services,Real Estate Investment Trusts
PKG,Packaging Corporation of America Common Stock,$148.39,1.72,1.173%,14095679767.00,United States,2000,875052,Basic Industries,Paper
PKI,PerkinElmer Inc. Common Stock,$182.49,-0.46,-0.251%,23030273038.00,United States,,636821,Health Care,Medical Specialities
PKX,POSCO Common Stock,$56.85,0.87,1.554%,17197255073.00,South Korea,1994,186229,Basic Industries,Steel/Iron Ore
PL,Planet Labs PBC Class A Common Stock,$6.10,0.17,2.867%,1602472220.00,,2021,1834778,Capital Goods,Aerospace
PLAB,Photronics Inc. Common Stock,$17.73,-0.04,-0.225%,1079765032.00,United States,1987,454359,Technology,Semiconductors
PLAN,Anaplan Inc. Common Stock,$46.32,0.10,0.216%,6839686331.00,United States,2018,1919465,Technology,Computer Software: Prepackaged Software
PLAY,Dave & Buster's Entertainment Inc. Common Stock,$37.85,1.33,3.642%,1832803737.00,United States,2014,1584279,Consumer Services,Movies/Entertainment
PLBY,PLBY Group Inc. Common Stock,$15.55,0.15,0.974%,643461846.00,United States,2020,853000,Consumer Non-Durables,Recreational Products/Toys
PLCE,Children's Place Inc. (The) Common Stock,$69.20,3.05,4.611%,993842719.00,United States,1997,338691,Consumer Services,Clothing/Shoe/Accessory Stores
PLD,Prologis Inc. Common Stock,$152.05,-1.44,-0.938%,112414670350.00,United States,,3816315,Consumer Services,Real Estate Investment Trusts
PLL,Piedmont Lithium Inc. Common Stock,$47.64,-1.19,-2.437%,756017978.00,United States,,536304,Basic Industries,Precious Metals
PLMI,Plum Acquisition Corp. I Class A Ordinary Share,$9.70,-0.01,-0.103%,387049817.00,United States,2021,3203,Finance,Business Services
PLMR,Palomar Holdings Inc. Common stock,$54.66,1.21,2.264%,1389200243.00,United States,2019,134449,Finance,Property-Casualty Insurers
PLNT,Planet Fitness Inc. Common Stock,$88.39,1.47,1.691%,7366826012.00,United States,2015,946431,Consumer Services,Other Consumer Services
PLOW,Douglas Dynamics Inc. Common Stock,$36.04,-0.48,-1.314%,828233474.00,United States,2010,47617,Capital Goods,Construction/Ag Equipment/Trucks
PLRX,Pliant Therapeutics Inc. Common Stock,$10.99,0.44,4.171%,396068544.00,United States,2020,196641,Consumer Durables,Specialty Chemicals
PLSE,Pulse Biosciences Inc Common Stock (DE),$10.86,-0.34,-3.036%,321795733.00,United States,2016,66875,Health Care,Medical/Dental Instruments
PLTK,Playtika Holding Corp. Common Stock,$15.65,-0.73,-4.457%,6410775512.00,Israel,2021,1815754,Technology,EDP Services
PLTR,Palantir Technologies Inc. Class A Common Stock,$12.98,0.04,0.309%,26022575671.00,,2020,45515054,Technology,Retail: Computer Software & Peripheral Equipment
PLUG,Plug Power Inc. Common Stock,$21.46,0.03,0.14%,12368595618.00,United States,1999,15147321,Consumer Durables,Electrical Products
PLUS,ePlus inc. Common Stock,$45.57,-0.67,-1.449%,1225250433.00,United States,1996,92015,Technology,Retail: Computer Software & Peripheral Equipment
PLXS,Plexus Corp. Common Stock,$77.43,-0.70,-0.896%,2175534372.00,United States,,196887,Technology,Electrical Products
PLYA,Playa Hotels & Resorts N.V. Ordinary Shares,$7.97,0.40,5.284%,1309317498.00,Netherlands,,7008610,Consumer Services,Hotels/Resorts
PLYM,Plymouth Industrial REIT Inc. Common Stock,$27.99,-0.41,-1.444%,968606797.00,United States,2017,211921,Consumer Services,Real Estate Investment Trusts
PM,Philip Morris International Inc Common Stock,$103.58,-0.01,-0.01%,161256211094.00,United States,,5195732,Consumer Non-Durables,Farming/Seeds/Milling
PMF,PIMCO Municipal Income Fund Common Stock,$13.63,0.03,0.221%,354554737.00,United States,2001,39720,Finance,Finance/Investors Services
PMGM,Priveterra Acquisition Corp. Class A Common Stock,$9.75,0.03,0.309%,336375000.00,United States,2021,5036,,
PML,Pimco Municipal Income Fund II Common Shares of Beneficial Interest,$13.73,0.01,0.073%,868540578.00,United States,2002,134256,Finance,Investment Managers
PMM,Putnam Managed Municipal Income Trust Common Stock,$7.40,0.05,0.68%,362187450.00,United States,1989,186181,Finance,Investment Managers
PMO,Putnam Municipal Opportunities Trust Common Stock,$12.48,0.02,0.161%,425909228.00,United States,1993,81979,Finance,Finance Companies
PMT,PennyMac Mortgage Investment Trust Common Shares of Beneficial Interest,$16.27,-0.05,-0.306%,1543978339.00,United States,2009,1461626,Consumer Services,Real Estate Investment Trusts
PMVP,PMV Pharmaceuticals Inc. Common Stock,$15.64,0.55,3.645%,709748737.00,United States,2020,232009,Consumer Durables,Specialty Chemicals
PMX,PIMCO Municipal Income Fund III Common Shares of Beneficial Interest,$11.21,-0.03,-0.267%,372593238.00,United States,2002,58659,Finance,Trusts Except Educational Religious and Charitable
PNC,PNC Financial Services Group Inc. (The) Common Stock,$209.70,-0.65,-0.309%,88074000000.00,United States,,2383236,Finance,Major Banks
PNFP,Pinnacle Financial Partners Inc. Common Stock,$98.74,0.37,0.376%,7517711592.00,United States,,396513,Finance,Major Banks
PNM,PNM Resources Inc. (Holding Co.) Common Stock,$45.48,0.03,0.066%,3903770070.00,United States,,2040336,Public Utilities,Electric Utilities: Central
PNNT,PennantPark Investment Corporation Common Stock,$7.19,0.04,0.559%,482054305.00,United States,2007,194632,Finance,Finance/Investors Services
PNR,Pentair plc. Ordinary Share,$60.15,0.34,0.568%,9953514873.00,Switzerland,,1069463,Capital Goods,Fluid Controls
PNT,POINT Biopharma Global Inc. Common Stock,$6.94,-0.03,-0.43%,625445250.00,United States,2020,121587,Consumer Durables,Specialty Chemicals
PNTG,The Pennant Group Inc. Common Stock ,$14.50,-0.21,-1.428%,412918226.00,United States,,106425,Health Care,Hospital/Nursing Management
PNTM,Pontem Corporation Class A Ordinary Shares,$9.76,0.00,0.00%,841800000.00,,2021,36519,Finance,Business Services
PNW,Pinnacle West Capital Corporation Common Stock,$70.66,0.33,0.469%,7971778033.00,United States,,776873,Public Utilities,Electric Utilities: Central
PODD,Insulet Corporation Common Stock,$242.53,-0.96,-0.394%,16726635874.00,United States,2007,348058,Health Care,Medical/Dental Instruments
POLY,Plantronics Inc. Common Stock,$27.25,0.38,1.414%,1164434983.00,United States,,264331,Public Utilities,Telecommunications Equipment
POND,Angel Pond Holdings Corporation Class A Ordinary Shares,$9.80,-0.04,-0.407%,325255650.00,,2021,421,,
POOL,Pool Corporation Common Stock,$449.10,0.48,0.107%,18003507776.00,United States,1995,356843,Consumer Non-Durables,Recreational Products/Toys
POR,Portland General Electric Co Common Stock,$52.47,0.47,0.904%,4691322394.00,United States,,434767,Public Utilities,Electric Utilities: Central
POSH,Poshmark Inc. Class A Common Stock,$15.45,0.15,0.98%,1189696783.00,United States,2021,498166,Consumer Non-Durables,Department/Specialty Retail Stores
POST,Post Holdings Inc. Common Stock,$103.71,-0.39,-0.375%,6488477075.00,United States,2012,591404,Consumer Non-Durables,Food Distributors
POW,Powered Brands Class A Ordinary Shares,$9.749,0.009,0.092%,336340500.00,United States,2021,25311,Finance,Business Services
POWI,Power Integrations Inc. Common Stock,$83.81,0.70,0.842%,5056398520.00,United States,1997,528324,Technology,Semiconductors
POWL,Powell Industries Inc. Common Stock,$29.10,1.24,4.451%,342327831.00,United States,,73193,Consumer Durables,Electrical Products
POWW,AMMO Inc. Common Stock,$4.46,0.12,2.765%,513404051.00,United States,,1531333,Capital Goods,Military/Government/Technical
PPBI,Pacific Premier Bancorp Inc,$38.83,0.37,0.962%,3665145955.00,United States,,276104,Finance,Major Banks
PPC,Pilgrim's Pride Corporation Common Stock,$28.62,0.85,3.061%,6973993440.00,United States,,1358702,Consumer Non-Durables,Meat/Poultry/Fish
PPG,PPG Industries Inc. Common Stock,$152.83,-0.16,-0.105%,36281972364.00,United States,,1609469,Basic Industries,Paints/Coatings
PPGH,Poema Global Holdings Corp. Class A Ordinary Share,$9.89,0.00,0.00%,426506250.00,China,2021,23534,Finance,Business Services
PPL,PPL Corporation Common Stock,$29.29,-0.12,-0.408%,21988468770.00,United States,,4537275,Public Utilities,Electric Utilities: Central
PPT,Putnam Premier Income Trust Common Stock,$4.13,0.04,0.978%,422136151.00,United States,1988,87761,Finance,Finance Companies
PRA,ProAssurance Corporation Common Stock,$23.94,0.18,0.758%,1292366450.00,United States,,146341,Finance,Property-Casualty Insurers
PRAA,PRA Group Inc. Common Stock,$45.75,0.42,0.927%,1995295619.00,United States,2002,190292,Technology,Advertising
PRAX,Praxis Precision Medicines Inc. Common Stock,$13.33,0.18,1.369%,597927507.00,United States,2020,190047,Health Care,Biotechnology: Pharmaceutical Preparations
PRCH,Porch Group Inc. Common Stock,$9.40,-0.28,-2.893%,921802615.00,United States,2020,810089,Technology,Computer Software: Prepackaged Software
PRCT,PROCEPT BioRobotics Corporation Common Stock,$20.00,0.99,5.208%,869936620.00,United States,2021,153165,Health Care,Medical Specialities
PRDO,Perdoceo Education Corporation Common Stock,$10.58,-0.09,-0.843%,741716412.00,United States,,372978,Miscellaneous,Other Consumer Services
PRDS,Pardes Biosciences Inc. Common Stock,$11.18,0.33,3.041%,697397175.00,United States,2021,282799,Consumer Durables,Specialty Chemicals
PRFT,Perficient Inc. Common Stock,$102.40,-1.56,-1.501%,3372897178.00,United States,1999,192183,Technology,EDP Services
PRG,PROG Holdings Inc. Common Stock,$38.25,0.33,0.87%,2169456462.00,United States,,420887,Technology,Diversified Commercial Services
PRGO,Perrigo Company plc Ordinary Shares,$36.95,0.26,0.709%,4942944903.00,United States,,1637946,Health Care,Biotechnology: Pharmaceutical Preparations
PRGS,Progress Software Corporation Common Stock (DE),$45.19,0.33,0.736%,1996554664.00,United States,1991,338241,Technology,Computer Software: Prepackaged Software
PRI,Primerica Inc. Common Stock,$153.75,0.05,0.033%,6071565360.00,United States,2010,112543,Finance,Life Insurance
PRIM,Primoris Services Corporation Common Stock,$25.76,0.13,0.507%,1386423834.00,United States,,277988,Basic Industries,Water Sewer Pipeline Comm & Power Line Construction
PRK,Park National Corporation Common Stock,$132.73,-0.58,-0.435%,2152822597.00,United States,,18388,Finance,Major Banks
PRLB,Proto Labs Inc. Common stock,$51.18,1.57,3.165%,1412038236.00,United States,2012,322958,Capital Goods,Office Equipment/Supplies/Services
PRLD,Prelude Therapeutics Incorporated Common Stock,$10.09,0.25,2.541%,476402902.00,United States,2020,158237,Consumer Durables,Specialty Chemicals
PRM,Perimeter Solutions SA Ordinary Shares,$13.20,0.01,0.076%,2074216782.00,,2021,182563,,
PRMW,Primo Water Corporation Common Stock,$16.13,0.28,1.767%,2582392467.00,Canada,,1142090,Consumer Non-Durables,Soft Drinks
PRO,PROS Holdings Inc. Common Stock,$30.63,1.24,4.219%,1359730911.00,United States,2007,265082,Technology,EDP Services
PROC,Procaps Group S.A. Ordinary Shares,$9.13,-0.37,-3.895%,1030084791.00,Luxembourg,,29351,,
PRPB,CC Neuberger Principal Holdings II Class A Ordinary Shares,$9.90,-0.01,-0.101%,1074150000.00,United States,2020,178310,Finance,Business Services
PRPC,CC Neuberger Principal Holdings III Class A Ordinary Shares,$9.77,0.04,0.411%,540403125.00,,2021,23650,Finance,Business Services
PRPL,Purple Innovation Inc. Common Stock,$6.99,-0.13,-1.826%,464694305.00,United States,2015,1729340,Consumer Durables,Home Furnishings
PRQR,ProQR Therapeutics N.V. Ordinary Shares,$5.94,0.52,9.594%,437844154.00,Netherlands,2014,1429896,Health Care,Biotechnology: Pharmaceutical Preparations
PRS,Prudential Financial Inc. 5.625% Junior Subordinated Notes due 2058,$26.14,0.23,0.888%,890369361.00,United States,2018,28189,Finance,Investment Bankers/Brokers/Service
PRSR,Prospector Capital Corp. Class A Ordinary Shares,$9.7494,-0.0006,-0.006%,396069375.00,United States,2021,8421,Finance,Business Services
PRTA,Prothena Corporation plc Ordinary Shares,$34.71,0.99,2.936%,1617270173.00,United States,,348158,Health Care,Biotechnology: Pharmaceutical Preparations
PRTC,PureTech Health plc American Depositary Shares,$36.00,1.00,2.857%,1036067688.00,United Kingdom,,2174,Finance,Investment Managers
PRTH,Priority Technology Holdings Inc. Common Stock,$5.91,-0.05,-0.839%,452913683.00,United States,2016,15565,Technology,EDP Services
PRTS,CarParts.com Inc. Common Stock,$8.84,0.18,2.079%,441028077.00,United States,2007,392425,Consumer Services,Other Specialty Stores
PRTY,Party City Holdco Inc. Common Stock,$4.25,0.12,2.906%,476957878.00,United States,2015,3818649,Miscellaneous,Diversified Commercial Services
PRU,Prudential Financial Inc. Common Stock,$119.27,0.93,0.786%,45084060000.00,United States,2001,1993332,Finance,Life Insurance
PRVA,Privia Health Group Inc. Common Stock,$22.95,0.99,4.508%,2444141631.00,United States,2021,421669,Technology,Retail: Computer Software & Peripheral Equipment
PRVB,Provention Bio Inc. Common Stock,$5.71,0.48,9.178%,361869754.00,United States,2018,996065,Health Care,Biotechnology: Pharmaceutical Preparations
PSA,Public Storage Common Stock,$362.75,-0.10,-0.028%,63609866640.00,United States,,618158,Consumer Services,Real Estate Investment Trusts
PSAG,Property Solutions Acquisition Corporation II Class A Common Stock,$9.72,0.02,0.206%,392338080.00,United States,2021,9568,,
PSB,PS Business Parks Inc. (MD) Common Stock,$162.41,-0.89,-0.545%,4474492134.00,United States,,61362,Consumer Services,Real Estate Investment Trusts
PSEC,Prospect Capital Corporation Common Stock,$8.41,0.01,0.119%,3278777265.00,United States,2004,1177489,Finance,Finance/Investors Services
PSFE,Paysafe Limited Common Shares,$3.43,-0.01,-0.291%,2482333470.00,,2021,3540873,Miscellaneous,Business Services
PSMT,PriceSmart Inc. Common Stock,$68.81,0.47,0.688%,2123641125.00,United States,,76446,Consumer Services,Department/Specialty Retail Stores
PSN,Parsons Corporation Common Stock,$30.78,0.30,0.984%,3147494468.00,,2019,360879,Capital Goods,Industrial Machinery/Components
PSNL,Personalis Inc. Common Stock,$11.70,0.18,1.563%,523971174.00,United States,2019,455604,Health Care,Biotechnology: In Vitro & In Vivo Diagnostic Substances
PSO,Pearson Plc Common Stock,$8.49,0.07,0.831%,6428952513.00,United Kingdom,,294239,Consumer Services,Books
PSPC,Post Holdings Partnering Corporation Series A Common Stock,$9.71,0.07,0.726%,429327650.00,,2021,11097,,
PSTG,Pure Storage Inc. Class A Common Stock,$26.45,0.07,0.265%,7669100901.00,,2015,2068958,Technology,Electronic Components
PSTH,Pershing Square Tontine Holdings Ltd. Class A Common Stock,$19.85,0.05,0.253%,3970001985.00,,2020,391807,,
PSTL,Postal Realty Trust Inc. Class A Common Stock,$17.73,-0.07,-0.393%,329718179.00,,2019,111889,Consumer Services,Real Estate Investment Trusts
PSX,Phillips 66 Common Stock,$90.29,1.45,1.632%,39584396810.00,United States,,4104792,Energy,Integrated oil Companies
PSXP,Phillips 66 Partners LP Common Units representing limited partner interest in the Partnership,$44.61,0.63,1.432%,10186253913.00,United States,2013,593420,Energy,Oil & Gas Production
PTA,Cohen & Steers Tax-Advantaged Preferred Securities and Income Fund Common Shares of Beneficial Interest,$22.75,-0.07,-0.307%,1257471147.00,,2020,101203,Finance,Trusts Except Educational Religious and Charitable
PTC,PTC Inc. Common Stock,$115.17,-0.59,-0.51%,13575307069.00,United States,,464882,Technology,Computer Software: Prepackaged Software
PTCT,PTC Therapeutics Inc. Common Stock,$43.17,1.08,2.566%,3052028343.00,United States,2013,464066,Health Care,Biotechnology: Pharmaceutical Preparations
PTEN,Patterson-UTI Energy Inc. Common Stock,$10.78,-0.07,-0.645%,2318909473.00,United States,1993,2411690,Energy,Oil & Gas Production
PTGX,Protagonist Therapeutics Inc. Common Stock,$28.00,-0.24,-0.85%,1336390356.00,United States,2016,447080,Health Care,Biotechnology: Pharmaceutical Preparations
PTLO,Portillo's Inc. Class A Common Stock,$27.05,0.24,0.895%,968583976.00,United States,2021,421096,Consumer Services,Restaurants
PTNR,Partner Communications Company Ltd. American Depositary Shares,$8.36,0.18,2.20%,1544596693.00,Israel,,2504,Public Utilities,Telecommunications Equipment
PTOC,Pine Technology Acquisition Corp. Class A Common Stock,$9.88,0.03,0.305%,426075000.00,United States,2021,2040,,
PTON,Peloton Interactive Inc. Class A Common Stock,$29.75,5.15,20.935%,9823393594.00,United States,2019,105729467,Consumer Services,Other Consumer Services
PTR,PetroChina Company Limited Common Stock,$52.61,0.85,1.642%,96287336421.00,China,,283945,Energy,Oil & Gas Production
PTRA,Proterra Inc. Common Stock,$7.72,0.01,0.13%,1685329878.00,United States,2020,977469,Capital Goods,Auto Manufacturing
PTSI,P.A.M. Transportation Services Inc. Common Stock,$75.94,2.43,3.306%,848554395.00,United States,1986,27756,Transportation,Trucking Freight/Courier Services
PTVE,Pactiv Evergreen Inc. Common stock,$10.31,-0.07,-0.674%,1827457542.00,United States,2020,141681,Consumer Durables,Containers/Packaging
PTY,Pimco Corporate & Income Opportunity Fund,$15.94,0.03,0.189%,1818913400.00,United States,2002,619609,Finance,Investment Managers
PUBM,PubMatic Inc. Class A Common Stock,$26.53,0.26,0.99%,1268837151.00,United States,2020,721953,Technology,Computer Software: Prepackaged Software
PUCK,Goal Acquisitions Corp. Common Stock,$9.71,0.00,0.00%,321995738.00,United States,2021,69265,,
PUK,Prudential Public Limited Company Common Stock,$34.08,0.55,1.64%,46798883280.00,United Kingdom,,292945,Finance,Life Insurance
PUMP,ProPetro Holding Corp. Common Stock,$11.13,-0.11,-0.979%,1150522736.00,United States,2017,819518,Energy,Oilfield Services/Equipment
PUYI,Puyi Inc. American Depository Shares,$6.72,-0.18,-2.609%,405314623.00,China,2019,117959,Finance,Investment Managers
PV,Primavera Capital Acquisition Corporation Class A Ordinary Shares,$9.74,0.00,0.00%,523525000.00,,2021,19488,Finance,Business Services
PVBC,Provident Bancorp Inc. (MD) Common Stock,$17.64,0.04,0.227%,314956008.00,United States,2015,17230,Finance,Major Banks
PVG,Pretium Resources Inc. Ordinary Shares (Canada),$13.85,0.15,1.095%,2602928267.00,Canada,,877178,,
PVH,PVH Corp. Common Stock,$96.39,0.00,0.00%,6878364375.00,United States,,917382,,
PWP,Perella Weinberg Partners Class A Common Stock,$10.90,-0.13,-1.179%,1073656333.00,United States,2020,576922,Finance,Investment Bankers/Brokers/Service
PWR,Quanta Services Inc. Common Stock,$98.87,-1.08,-1.081%,14088903814.00,United States,,1241535,Capital Goods,Engineering & Construction
PWSC,PowerSchool Holdings Inc. Class A Common Stock,$17.54,1.05,6.367%,3479968133.00,,2021,606751,Technology,Computer Software: Prepackaged Software
PX,P10 Inc. Class A Common Stock,$12.60,-0.06,-0.474%,1476160510.00,,2021,202026,Finance,Investment Managers
PXD,Pioneer Natural Resources Company Common Stock,$226.48,-1.37,-0.601%,55291400602.00,United States,,2072579,Energy,Oil & Gas Production
PYCR,Paycor HCM Inc. Common Stock,$26.00,-0.11,-0.421%,4535177478.00,United States,2021,449672,Technology,Computer Software: Prepackaged Software
PYPL,PayPal Holdings Inc. Common Stock,$121.41,-4.67,-3.704%,141443246487.00,United States,,30353315,Miscellaneous,Business Services
PYR,PyroGenesis Canada Inc. Common Shares,$2.69,0.08,3.065%,459443136.00,Canada,,237563,,
PYXS,Pyxis Oncology Inc. Common Stock,$9.45,0.90,10.526%,309618732.00,United States,2021,23784,Health Care,Biotechnology: Pharmaceutical Preparations
PZN,Pzena Investment Management Inc Class A Common Stock,$10.06,0.29,2.968%,726045189.00,United States,2007,122312,Finance,Investment Managers
PZZA,Papa John's International Inc. Common Stock,$118.87,-2.33,-1.922%,4322577268.00,United States,1993,313345,Consumer Services,Restaurants
QCOM,QUALCOMM Incorporated Common Stock,$175.09,-4.38,-2.441%,197326430000.00,United States,1991,10327776,Technology,Computer peripheral equipment
QCRH,QCR Holdings Inc. Common Stock,$56.75,-0.04,-0.07%,886063855.00,United States,,26445,Finance,Major Banks
QDEL,Quidel Corporation Common Stock,$96.40,-2.47,-2.498%,4018525484.00,United States,,450879,Health Care,Biotechnology: In Vitro & In Vivo Diagnostic Substances
QFIN,360 DigiTech Inc. American Depositary Shares,$19.10,-0.16,-0.831%,2952092753.00,China,2018,757595,Finance,Finance: Consumer Services
QGEN,Qiagen N.V. Common Shares ,$50.02,0.25,0.502%,11371346720.00,Netherlands,,788104,Health Care,Biotechnology: Biological Products (No Diagnostic Substances)
QIWI,QIWI plc American Depositary Shares,$7.26,0.01,0.138%,453247855.00,Cyprus,2013,141518,Miscellaneous,Business Services
QLYS,Qualys Inc. Common Stock,$129.24,0.23,0.178%,5017627201.00,United States,2012,326884,Technology,EDP Services
QNST,QuinStreet Inc. Common Stock,$15.82,0.39,2.528%,858114895.00,United States,2010,286786,Technology,Advertising
QQQX,Nuveen NASDAQ 100 Dynamic Overwrite Fund Shares of Beneficial Interest,$27.03,-0.08,-0.295%,1168836017.00,United States,,130151,Finance,Finance Companies
QRTEA,Qurate Retail Inc. Series A Common Stock ,$6.93,0.07,1.02%,2749430397.00,United States,,3774308,Consumer Services,Catalog/Specialty Distribution
QRTEB,Qurate Retail Inc. Series B Common Stock ,$7.0511,0.1511,2.19%,2797475999.00,United States,,1732,Consumer Services,Catalog/Specialty Distribution
QRVO,Qorvo Inc. Common Stock,$128.50,-2.95,-2.244%,13933464070.00,United States,,2036241,Capital Goods,Industrial Machinery/Components
QS,QuantumScape Corporation Class A Common Stock,$16.38,-0.04,-0.244%,6922120842.00,United States,2020,5559751,Capital Goods,Auto Parts:O.E.M.
QSI,Quantum-Si Incorporated Class A Common Stock,$4.30,-0.13,-2.935%,590890017.00,United States,2020,956852,Health Care,Biotechnology: Pharmaceutical Preparations
QSR,Restaurant Brands International Inc. Common Shares,$55.94,0.20,0.359%,17625116268.00,Canada,2014,635265,,
QTRX,Quanterix Corporation Common Stock,$33.18,0.85,2.629%,1215981237.00,United States,2017,196003,Health Care,Industrial Specialties
QTWO,Q2 Holdings Inc. Common Stock,$64.57,1.24,1.958%,3668662713.00,,2014,382687,Technology,EDP Services
QUOT,Quotient Technology Inc. Common Stock,$6.71,0.20,3.072%,633569325.00,,2014,550900,Technology,Advertising
QURE,uniQure N.V. Ordinary Shares,$17.48,0.19,1.099%,807824985.00,Netherlands,2014,411583,Health Care,Biotechnology: Pharmaceutical Preparations
R,Ryder System Inc. Common Stock,$70.94,-0.81,-1.129%,3809000077.00,United States,,400477,Miscellaneous,Rental/Leasing Companies
RA,Brookfield Real Assets Income Fund Inc. Common Stock,$21.14,0.07,0.332%,1054049871.00,,2016,402694,Finance,Investment Managers
RAAS,Cloopen Group Holding Limited American Depositary Shares each representing two Class A Ordinary Shares,$2.02,0.06,3.061%,332027751.00,,2021,542964,Technology,Computer Software: Prepackaged Software
RACE,Ferrari N.V. Common Shares,$225.52,-4.61,-2.003%,41415819985.00,,2015,577688,Capital Goods,Auto Manufacturing
RAD,Rite Aid Corporation Common Stock,$10.71,0.28,2.685%,597427084.00,United States,,2109848,Health Care,Medical/Nursing Services
RADA,RADA Electronic Industries Ltd. Ordinary Shares,$9.88,0.41,4.329%,429632442.00,Israel,,220943,,
