Symbol,Name,Last Sale,Net Change,% Change,Market Cap,Country,IPO Year,Volume,Sector,Industry
PKOH,Park-Ohio Holdings Corp. Common Stock,$19.07,-0.15,-0.78%,240283735.00,United States,,43712,Capital Goods,Office Equipment/Supplies/Services
PLAB,Photronics Inc. Common Stock,$17.77,0.24,1.369%,1082201050.00,United States,1987,356486,Technology,Semiconductors
PLAY,Dave & Buster's Entertainment Inc. Common Stock,$36.52,0.64,1.784%,1768401386.00,United States,2014,866736,Consumer Services,Movies/Entertainment
PLBC,Plumas Bancorp,$37.59,0.21,0.562%,218661030.00,United States,,7605,Finance,Finance Companies
PLBY,PLBY Group Inc. Common Stock,$15.40,0.00,0.00%,637254818.00,United States,2020,1294755,Consumer Non-Durables,Recreational Products/Toys
PLCE,Children's Place Inc. (The) Common Stock,$66.15,-1.05,-1.563%,950038957.00,United States,1997,365622,Consumer Services,Clothing/Shoe/Accessory Stores
PLL,Piedmont Lithium Inc. Common Stock,$48.83,3.43,7.555%,774902558.00,United States,,298862,Basic Industries,Precious Metals
PLMI,Plum Acquisition Corp. I Class A Ordinary Share,$9.71,0.00,0.00%,387448838.00,United States,2021,9896,Finance,Business Services
PLMR,Palomar Holdings Inc. Common stock,$53.45,1.70,3.285%,1358447732.00,United States,2019,503941,Finance,Property-Casualty Insurers
PLPC,Preformed Line Products Company Common Stock,$60.45,1.24,2.094%,296201675.00,United States,,6774,Basic Industries,Telecommunications Equipment
PLRX,Pliant Therapeutics Inc. Common Stock,$10.55,-0.32,-2.944%,380211387.00,United States,2020,161088,Consumer Durables,Specialty Chemicals
PLSE,Pulse Biosciences Inc Common Stock (DE),$11.20,0.09,0.81%,331870370.00,United States,2016,57157,Health Care,Medical/Dental Instruments
PLTK,Playtika Holding Corp. Common Stock,$16.38,0.84,5.405%,6709808491.00,Israel,2021,3089337,Technology,EDP Services
PLUG,Plug Power Inc. Common Stock,$21.43,0.51,2.438%,12351304944.00,United States,1999,15524141,Consumer Durables,Electrical Products
PLUS,ePlus inc. Common Stock,$46.24,0.61,1.337%,1249263213.00,United States,1996,124690,Technology,Retail: Computer Software & Peripheral Equipment
PLXP,PLx Pharma Inc. Common Stock,$6.21,0.16,2.645%,171005571.00,United States,2014,114346,Health Care,Biotechnology: Pharmaceutical Preparations
PLXS,Plexus Corp. Common Stock,$78.13,-0.88,-1.114%,2187405610.00,United States,,127841,Technology,Electrical Products
PLYA,Playa Hotels & Resorts N.V. Ordinary Shares,$7.57,-0.06,-0.786%,1243605202.00,Netherlands,,417094,Consumer Services,Hotels/Resorts
PME,Pingtan Marine Enterprise Ltd.,$0.6352,0.0079,1.259%,54589701.00,China,,73139,,Farming/Seeds/Milling
PMGM,Priveterra Acquisition Corp. Class A Common Stock,$9.72,0.005,0.051%,335340000.00,United States,2021,5726,,
PMTS,CPI Card Group Inc. Common Stock,$15.26,1.07,7.541%,171758411.00,United States,,21206,Finance,Finance Companies
PMVP,PMV Pharmaceuticals Inc. Common Stock,$15.09,0.23,1.548%,684789542.00,United States,2020,705625,Consumer Durables,Specialty Chemicals
PNBK,Patriot National Bancorp Inc. Common Stock,$15.40,0.17,1.116%,60798830.00,United States,,3018,Finance,Major Banks
PNFP,Pinnacle Financial Partners Inc. Common Stock,$98.37,1.63,1.685%,7489541111.00,United States,,406503,Finance,Major Banks
PNNT,PennantPark Investment Corporation Common Stock,$7.15,0.07,0.989%,479372501.00,United States,2007,175910,Finance,Finance/Investors Services
PNRG,PrimeEnergy Resources Corporation Common Stock,$71.12,-0.13,-0.182%,141825868.00,United States,,9553,Energy,Oil & Gas Production
PNT,POINT Biopharma Global Inc. Common Stock,$6.97,0.18,2.651%,628148904.00,United States,2020,365628,Consumer Durables,Specialty Chemicals
PNTG,The Pennant Group Inc. Common Stock ,$14.71,-0.26,-1.737%,418898420.00,United States,,121499,Health Care,Hospital/Nursing Management
PODD,Insulet Corporation Common Stock,$243.49,1.43,0.591%,16792844468.00,United States,2007,449713,Health Care,Medical/Dental Instruments
PONO,Pono Capital Corp Class A Common Stock,$10.01,0.0172,0.172%,143893750.00,United States,2021,19479,,
POOL,Pool Corporation Common Stock,$448.62,-9.43,-2.059%,17984265550.00,United States,1995,370246,Consumer Non-Durables,Recreational Products/Toys
POSH,Poshmark Inc. Class A Common Stock,$15.30,1.01,7.068%,1178146328.00,United States,2021,1169318,Consumer Non-Durables,Department/Specialty Retail Stores
POW,Powered Brands Class A Ordinary Shares,$9.74,-0.01,-0.103%,336030000.00,United States,2021,50522,Finance,Business Services
POWI,Power Integrations Inc. Common Stock,$83.11,3.98,5.03%,5014166340.00,United States,1997,887275,Technology,Semiconductors
POWL,Powell Industries Inc. Common Stock,$27.86,-0.78,-2.723%,327740666.00,United States,,125596,Consumer Durables,Electrical Products
POWW,AMMO Inc. Common Stock,$4.34,0.13,3.088%,499590489.00,United States,,1312606,Capital Goods,Military/Government/Technical
PPBI,Pacific Premier Bancorp Inc,$38.46,0.68,1.80%,3630221824.00,United States,,246793,Finance,Major Banks
PPC,Pilgrim's Pride Corporation Common Stock,$27.77,-0.35,-1.245%,6766869246.00,United States,,443247,Consumer Non-Durables,Meat/Poultry/Fish
PPGH,Poema Global Holdings Corp. Class A Ordinary Share,$9.89,-0.02,-0.202%,426506250.00,China,2021,91415,Finance,Business Services
PPIH,Perma-Pipe International Holdings Inc. Common Stock,$8.52,0.01,0.118%,68728369.00,United States,,5943,,
PPSI,Pioneer Power Solutions Inc. Common Stock,$6.07,-0.02,-0.328%,58518108.00,United States,,199535,Consumer Durables,Electrical Products
PPTA,Perpetua Resources Corp. Common Shares,$3.38,-0.12,-3.429%,212742077.00,Canada,,108081,,
PRAA,PRA Group Inc. Common Stock,$45.33,-0.15,-0.33%,1976978151.00,United States,2002,232448,Technology,Advertising
PRAX,Praxis Precision Medicines Inc. Common Stock,$13.15,0.42,3.299%,589853468.00,United States,2020,215302,Health Care,Biotechnology: Pharmaceutical Preparations
PRCH,Porch Group Inc. Common Stock,$9.68,0.52,5.677%,949260565.00,United States,2020,1124478,Technology,Computer Software: Prepackaged Software
PRCT,PROCEPT BioRobotics Corporation Common Stock,$19.01,0.38,2.04%,826874757.00,United States,2021,99043,Health Care,Medical Specialities
PRDO,Perdoceo Education Corporation Common Stock,$10.67,0.04,0.376%,748025909.00,United States,,501070,Miscellaneous,Other Consumer Services
PRDS,Pardes Biosciences Inc. Common Stock,$10.85,-0.06,-0.55%,676812107.00,United States,2021,184865,Consumer Durables,Specialty Chemicals
PRFT,Perficient Inc. Common Stock,$103.96,2.30,2.262%,3424281158.00,United States,1999,130109,Technology,EDP Services
PRGS,Progress Software Corporation Common Stock (DE),$44.86,0.33,0.741%,1981974823.00,United States,1991,172254,Technology,Computer Software: Prepackaged Software
PRIM,Primoris Services Corporation Common Stock,$25.63,-0.07,-0.272%,1379427130.00,United States,,269035,Basic Industries,Water Sewer Pipeline Comm & Power Line Construction
PRLD,Prelude Therapeutics Incorporated Common Stock,$9.84,0.35,3.688%,464599064.00,United States,2020,239036,Consumer Durables,Specialty Chemicals
PROC,Procaps Group S.A. Ordinary Shares,$9.50,-0.06,-0.628%,1071829739.00,Luxembourg,,49101,,
PROF,Profound Medical Corp. Common Stock,$9.46,0.11,1.176%,196477114.00,Canada,,29347,,
PROG,Progenity Inc. Common Stock,$1.53,0.04,2.685%,250536821.00,United States,2020,5850552,Consumer Durables,Specialty Chemicals
PROV,Provident Financial Holdings Inc. Common Stock,$16.75,0.00,0.00%,123781545.00,United States,,331,Finance,Savings Institutions
PRPH,ProPhase Labs Inc. Common Stock (DE),$6.99,0.05,0.72%,108246441.00,United States,,3037,Health Care,Biotechnology: Pharmaceutical Preparations
PRPL,Purple Innovation Inc. Common Stock,$7.12,0.06,0.85%,473336689.00,United States,2015,2967026,Consumer Durables,Home Furnishings
PRQR,ProQR Therapeutics N.V. Ordinary Shares,$5.42,0.26,5.039%,399514363.00,Netherlands,2014,976989,Health Care,Biotechnology: Pharmaceutical Preparations
PRSO,Peraso Inc. Common Stock,$2.58,0.11,4.453%,50964580.00,United States,,88571,,
PRSR,Prospector Capital Corp. Class A Ordinary Shares,$9.75,-0.005,-0.051%,396093750.00,United States,2021,3145,Finance,Business Services
PRTA,Prothena Corporation plc Ordinary Shares,$33.72,1.36,4.203%,1571142329.00,United States,,452682,Health Care,Biotechnology: Pharmaceutical Preparations
PRTC,PureTech Health plc American Depositary Shares,$35.00,-1.00,-2.778%,1007288030.00,United Kingdom,,925,Finance,Investment Managers
PRTG,Portage Biotech Inc. Common Stock,$8.28,0.00,0.00%,110485174.00,Canada,,15824,Health Care,Biotechnology: Biological Products (No Diagnostic Substances)
PRTH,Priority Technology Holdings Inc. Common Stock,$5.96,0.11,1.88%,456745440.00,United States,2016,13949,Technology,EDP Services
PRTK,Paratek Pharmaceuticals Inc. Common Stock,$4.06,0.08,2.01%,203766735.00,United States,,218501,Health Care,Biotechnology: Pharmaceutical Preparations
PRTS,CarParts.com Inc. Common Stock,$8.66,0.09,1.05%,432047868.00,United States,2007,748847,Consumer Services,Other Specialty Stores
PRVA,Privia Health Group Inc. Common Stock,$21.96,0.27,1.245%,2338708070.00,United States,2021,354012,Technology,Retail: Computer Software & Peripheral Equipment
PRVB,Provention Bio Inc. Common Stock,$5.23,0.18,3.564%,331449880.00,United States,2018,941148,Health Care,Biotechnology: Pharmaceutical Preparations
PSAG,Property Solutions Acquisition Corporation II Class A Common Stock,$9.70,0.00,0.00%,391530800.00,United States,2021,29226,,
PSEC,Prospect Capital Corporation Common Stock,$8.40,0.07,0.84%,3274878600.00,United States,2004,1060348,Finance,Finance/Investors Services
PSMT,PriceSmart Inc. Common Stock,$68.34,-0.23,-0.335%,2109135801.00,United States,,83078,Consumer Services,Department/Specialty Retail Stores
PSNL,Personalis Inc. Common Stock,$11.52,0.37,3.318%,515910079.00,United States,2019,401266,Health Care,Biotechnology: In Vitro & In Vivo Diagnostic Substances
PSTI,Pluristem Therapeutics Inc. Common Stock,$1.78,0.02,1.136%,57137315.00,Israel,,186464,Health Care,Biotechnology: Biological Products (No Diagnostic Substances)
PSTX,Poseida Therapeutics Inc. Common Stock,$4.25,-0.04,-0.932%,265651686.00,United States,2020,99409,Consumer Durables,Specialty Chemicals
PTC,PTC Inc. Common Stock,$115.76,2.13,1.875%,13644851491.00,United States,,528954,Technology,Computer Software: Prepackaged Software
PTCT,PTC Therapeutics Inc. Common Stock,$42.09,2.13,5.33%,2975674611.00,United States,2013,584401,Health Care,Biotechnology: Pharmaceutical Preparations
PTEN,Patterson-UTI Energy Inc. Common Stock,$10.85,0.41,3.927%,2333967327.00,United States,1993,2925206,Energy,Oil & Gas Production
PTGX,Protagonist Therapeutics Inc. Common Stock,$28.24,-0.71,-2.453%,1347845130.00,United States,2016,598122,Health Care,Biotechnology: Pharmaceutical Preparations
PTIC,PropTech Investment Corporation II Class A Common Stock,$9.77,0.00,0.00%,280887500.00,United States,2021,5,,
PTLO,Portillo's Inc. Class A Common Stock,$26.81,0.95,3.674%,959990255.00,United States,2021,557306,Consumer Services,Restaurants
PTMN,Portman Ridge Finance Corporation Common Stock,$25.03,-0.06,-0.239%,242293579.00,United States,,33178,Finance,Finance/Investors Services
PTNR,Partner Communications Company Ltd. American Depositary Shares,$8.18,-0.11,-1.327%,1511339827.00,Israel,,7758,Public Utilities,Telecommunications Equipment
PTOC,Pine Technology Acquisition Corp. Class A Common Stock,$9.85,-0.07,-0.706%,424781250.00,United States,2021,120922,Finance,Business Services
PTON,Peloton Interactive Inc. Class A Common Stock,$24.60,0.35,1.443%,8122873358.00,United States,2019,22949973,Consumer Services,Other Consumer Services
PTRA,Proterra Inc. Common Stock,$7.71,0.26,3.49%,1683146808.00,United States,2020,1316311,Capital Goods,Auto Manufacturing
PTRS,Partners Bancorp Common Stock,$10.045,-0.005,-0.05%,180209209.00,United States,,67925,Finance,Major Banks
PTSI,P.A.M. Transportation Services Inc. Common Stock,$73.51,-0.39,-0.528%,821401549.00,United States,1986,29004,Transportation,Trucking Freight/Courier Services
PTVE,Pactiv Evergreen Inc. Common stock,$10.38,-0.13,-1.237%,1839865110.00,United States,2020,137663,Consumer Durables,Containers/Packaging
PUBM,PubMatic Inc. Class A Common Stock,$26.27,1.67,6.789%,1256402260.00,United States,2020,1405953,Technology,Computer Software: Prepackaged Software
PUCK,Goal Acquisitions Corp. Common Stock,$9.71,0.00,0.00%,321995738.00,United States,2021,62650,,
PUYI,Puyi Inc. American Depository Shares,$6.90,0.32,4.863%,416171264.00,China,2019,181090,Finance,Investment Managers
PVBC,Provident Bancorp Inc. (MD) Common Stock,$17.60,0.61,3.59%,314241822.00,United States,2015,27673,Finance,Major Banks
PWFL,PowerFleet Inc. Common Stock,$3.68,0.11,3.081%,132307437.00,United States,,121485,Capital Goods,Telecommunications Equipment
PWOD,Penns Woods Bancorp Inc. Common Stock,$24.11,-0.07,-0.289%,170458833.00,United States,,5320,Finance,Major Banks
PWP,Perella Weinberg Partners Class A Common Stock,$11.03,0.08,0.731%,1086461408.00,United States,2020,1100912,Finance,Investment Bankers/Brokers/Service
PXLW,Pixelworks Inc.  Common Stock,$3.32,0.10,3.106%,176715287.00,United States,2000,444829,Technology,Semiconductors
PYCR,Paycor HCM Inc. Common Stock,$26.11,1.04,4.148%,4554364767.00,United States,2021,752265,Technology,Computer Software: Prepackaged Software
PYPD,PolyPid Ltd. Ordinary Shares,$4.09,-0.18,-4.215%,76714371.00,Israel,2020,47717,Health Care,Medical/Dental Instruments
PYPL,PayPal Holdings Inc. Common Stock,$126.08,1.78,1.432%,147261440000.00,United States,,33061459,Miscellaneous,Business Services
PYR,PyroGenesis Canada Inc. Common Shares,$2.61,0.13,5.242%,445779400.00,Canada,,85871,,
PYXS,Pyxis Oncology Inc. Common Stock,$8.55,-0.13,-1.498%,280131234.00,United States,2021,8212,Health Care,Biotechnology: Pharmaceutical Preparations
PZZA,Papa John's International Inc. Common Stock,$121.20,-0.98,-0.802%,4407305165.00,United States,1993,234956,Consumer Services,Restaurants
QCOM,QUALCOMM Incorporated Common Stock,$179.47,0.37,0.207%,202262690000.00,United States,1991,15699964,Technology,Computer peripheral equipment
QCRH,QCR Holdings Inc. Common Stock,$56.79,0.61,1.086%,886688393.00,United States,,46659,Finance,Major Banks
QDEL,Quidel Corporation Common Stock,$98.87,-0.81,-0.813%,4121489778.00,United States,,869206,Health Care,Biotechnology: In Vitro & In Vivo Diagnostic Substances
QFIN,360 DigiTech Inc. American Depositary Shares,$19.26,0.56,2.995%,2976822326.00,China,2018,523753,Finance,Finance: Consumer Services
QIPT,Quipt Home Medical Corp. Common Shares,$5.44,-0.01,-0.183%,181432660.00,United States,,38001,,
QIWI,QIWI plc American Depositary Shares,$7.25,0.12,1.683%,452623547.00,Cyprus,2013,183942,Miscellaneous,Business Services
QLI,Qilian International Holding Group Ltd. Ordinary Shares,$2.10,-0.04,-1.869%,75075000.00,China,2021,20714,Health Care,Biotechnology: Pharmaceutical Preparations
QLYS,Qualys Inc. Common Stock,$129.01,3.40,2.707%,5008697657.00,United States,2012,178898,Technology,EDP Services
QMCO,Quantum Corporation Common Stock,$4.60,-0.03,-0.648%,273332106.00,United States,,136853,Technology,Electronic Components
QNST,QuinStreet Inc. Common Stock,$15.43,0.15,0.982%,836960355.00,United States,2010,320390,Technology,Advertising
QQQX,Nuveen NASDAQ 100 Dynamic Overwrite Fund Shares of Beneficial Interest,$27.11,0.25,0.931%,1172295391.00,United States,,109075,Finance,Finance Companies
QRHC,Quest Resource Holding Corporation Common Stock,$6.54,0.24,3.81%,124396987.00,United States,,63074,Capital Goods,Building Products
QRTEA,Qurate Retail Inc. Series A Common Stock ,$6.86,0.07,1.031%,2721658373.00,United States,,3222024,Consumer Services,Catalog/Specialty Distribution
QRTEB,Qurate Retail Inc. Series B Common Stock ,$6.90,0.06,0.877%,2737528101.00,United States,,1329,Consumer Services,Catalog/Specialty Distribution
QRVO,Qorvo Inc. Common Stock,$131.45,2.73,2.121%,14488843189.00,United States,,2030755,Capital Goods,Industrial Machinery/Components
QSI,Quantum-Si Incorporated Class A Common Stock,$4.43,0.02,0.454%,608754134.00,United States,2020,1561035,Health Care,Biotechnology: Pharmaceutical Preparations
QTNT,Quotient Limited Ordinary Shares,$1.49,0.06,4.196%,152416974.00,Switzerland,2014,417478,Health Care,Biotechnology: Pharmaceutical Preparations
QTRX,Quanterix Corporation Common Stock,$32.33,1.08,3.456%,1184830422.00,United States,2017,390503,Health Care,Industrial Specialties
QTT,Qutoutiao Inc. American Depositary Shares,$2.24,0.10,4.673%,64398152.00,China,2018,69025,Technology,Computer Software: Prepackaged Software
QUBT,Quantum Computing Inc. Common Stock,$2.52,0.04,1.613%,73475174.00,United States,,88447,Technology,Computer Manufacturing
QUIK,QuickLogic Corporation Common Stock,$5.14,0.25,5.112%,60629626.00,United States,1999,42400,Technology,Semiconductors
QURE,uniQure N.V. Ordinary Shares,$17.29,0.54,3.224%,799044279.00,Netherlands,2014,580918,Health Care,Biotechnology: Pharmaceutical Preparations
RACB,Research Alliance Corp. II Class A Common Stock,$9.80,0.02,0.204%,188027700.00,United States,2021,151815,,
RADA,RADA Electronic Industries Ltd. Ordinary Shares,$9.47,0.11,1.175%,411803566.00,Israel,,103366,,
RADI,Radius Global Infrastructure Inc. Class A Common Stock,$13.35,0.28,2.142%,1230870000.00,United States,,447827,Consumer Services,Telecommunications Equipment
RAIL,FreightCar America Inc. Common Stock,$3.51,-0.06,-1.681%,55974770.00,United States,2005,50865,Capital Goods,Railroads
RAIN,Rain Therapeutics Inc. Common Stock,$7.77,-0.13,-1.646%,205646616.00,United States,2021,40558,Health Care,Biotechnology: Pharmaceutical Preparations
RAM,Aries I Acquisition Corporation Class A Ordinary Share,$9.9991,0.019,0.19%,179671328.00,Cayman Islands,2021,4096,Finance,Business Services
RANI,Rani Therapeutics Holdings Inc. Class A Common Stock,$19.25,-1.33,-6.463%,379453575.00,United States,2021,64984,Consumer Durables,Specialty Chemicals
RAPT,RAPT Therapeutics Inc. Common Stock,$19.76,0.26,1.333%,583830106.00,United States,2019,233448,Health Care,Biotechnology: Pharmaceutical Preparations
RARE,Ultragenyx Pharmaceutical Inc. Common Stock,$68.62,1.01,1.494%,4677291880.00,United States,2014,373561,Health Care,Biotechnology: Pharmaceutical Preparations
RBB,RBB Bancorp Common Stock,$26.57,-0.06,-0.225%,516933804.00,United States,2017,28696,Finance,Commercial Banks
RBBN,Ribbon Communications Inc. Common Stock,$4.36,0.02,0.461%,648004542.00,United States,,247698,Technology,EDP Services
RBCAA,Republic Bancorp Inc. Class A Common Stock,$49.13,0.47,0.966%,981666530.00,United States,1998,10826,Finance,Major Banks
RBKB,Rhinebeck Bancorp Inc. Common Stock,$11.00,-0.04,-0.362%,124257133.00,United States,2019,2282,Finance,Major Banks
RCAT,Red Cat Holdings Inc. Common Stock,$1.89,0.14,8.00%,101749244.00,United States,,245818,Technology,Retail: Computer Software & Peripheral Equipment
RCEL,Avita Medical Inc. Common Stock,$9.17,0.06,0.659%,228563332.00,United States,,156816,Health Care,Medical Specialities
RCHG,Recharge Acquisition Corp. Class A Common Stock,$9.93,0.00,0.00%,248746500.00,United States,2020,41102,,
RCII,Rent-A-Center Inc. Common Stock,$38.55,-0.55,-1.407%,2549706175.00,United States,1995,854014,Technology,Diversified Commercial Services
RCKT,Rocket Pharmaceuticals Inc. Common Stock,$16.59,0.56,3.493%,1069102751.00,United States,2015,640487,Health Care,Biotechnology: Pharmaceutical Preparations
RCKY,Rocky Brands Inc. Common Stock,$41.54,0.53,1.292%,303250266.00,United States,1993,22341,Consumer Non-Durables,Shoe Manufacturing
RCLF,Rosecliff Acquisition Corp I Class A Common Stock,$9.81,-0.03,-0.305%,310241250.00,United States,2021,196638,,
RCM,R1 RCM Inc. Common Stock,$23.29,-0.07,-0.30%,6479889176.00,United States,,831138,Consumer Services,Other Consumer Services
RCMT,RCM Technologies Inc. Common Stock,$7.06,0.21,3.066%,74017153.00,United States,,51803,Consumer Services,Military/Government/Technical
RDCM,Radcom Ltd. Ordinary Shares,$11.08,-0.23,-2.034%,154495708.00,Israel,1997,10413,Technology,Computer peripheral equipment
RDFN,Redfin Corporation Common Stock,$28.30,0.12,0.426%,2985122148.00,United States,2017,1241790,Finance,Real Estate
RDHL,Redhill Biopharma Ltd. American Depositary Shares,$2.53,0.04,1.606%,132576056.00,Israel,,178908,Health Care,Biotechnology: Pharmaceutical Preparations
RDI,Reading International Inc Class A Common Stock,$4.22,-0.03,-0.706%,92035689.00,United States,,18279,Consumer Services,Movies/Entertainment
RDIB,Reading International Inc Class B Common Stock,$18.49,0.49,2.722%,403255898.00,United States,,1589,Consumer Services,Movies/Entertainment
RDNT,RadNet Inc. Common Stock,$23.88,-0.32,-1.322%,1326366601.00,United States,,526506,Health Care,Medical Specialities
RDUS,Radius Health Inc. Common Stock,$7.00,0.07,1.01%,331395470.00,United States,2014,835827,Health Care,Biotechnology: Pharmaceutical Preparations
RDVT,Red Violet Inc. Common Stock ,$24.48,-0.38,-1.529%,328483387.00,United States,,25357,Technology,Computer Software: Prepackaged Software
RDWR,Radware Ltd. Ordinary Shares,$33.72,0.12,0.357%,1551076535.00,Israel,1999,162797,Technology,EDP Services
REAL,The RealReal Inc. Common Stock,$8.57,0.35,4.258%,791763583.00,United States,2019,3307952,Consumer Non-Durables,Consumer Specialties
REAX,The Real Brokerage Inc. Common Shares,$2.52,0.03,1.205%,448963200.00,Canada,,101110,,
REE,REE Automotive Ltd. Class A Ordinary Shares,$3.70,-0.02,-0.538%,850727058.00,Israel,,518051,,
REFI,Chicago Atlantic Real Estate Finance Inc. Common Stock,$19.00,-0.36,-1.86%,331617450.00,United States,2021,30389,Consumer Services,Real Estate Investment Trusts
REG,Regency Centers Corporation Common Stock,$70.25,-0.88,-1.237%,12027713461.00,United States,1993,677831,Consumer Services,Real Estate Investment Trusts
REGI,Renewable Energy Group Inc. Common Stock,$38.08,0.40,1.062%,1914300716.00,United States,2012,674076,Basic Industries,Major Chemicals
REGN,Regeneron Pharmaceuticals Inc. Common Stock,$622.96,2.27,0.366%,66994998493.00,United States,1991,1205835,Health Care,Biotechnology: Pharmaceutical Preparations
REKR,Rekor Systems Inc. Common Stock,$4.50,0.15,3.448%,197897481.00,United States,,298748,Technology,EDP Services
RELL,Richardson Electronics Ltd. Common Stock,$12.09,0.11,0.918%,163471997.00,United States,1983,100107,Technology,Electronic Components
RELY,Remitly Global Inc. Common Stock,$11.22,0.24,2.186%,1841274706.00,United States,2021,401275,Technology,Computer Software: Prepackaged Software
RENT,Rent the Runway Inc. Class A Common Stock,$5.43,0.44,8.818%,342286865.00,United States,2021,1102758,Consumer Non-Durables,Department/Specialty Retail Stores
REPH,Recro Pharma Inc. Common Stock,$1.57,0.03,1.948%,73770665.00,United States,2014,174456,Health Care,Biotechnology: Pharmaceutical Preparations
REPL,Replimune Group Inc. Common Stock,$18.26,0.01,0.055%,856274799.00,United States,2018,289021,Health Care,Biotechnology: Pharmaceutical Preparations
RESN,Resonant Inc. Common Stock,$1.44,0.07,5.109%,94623252.00,United States,2014,294745,Technology,Semiconductors
RETA,Reata Pharmaceuticals Inc. Class A Common Stock,$26.44,-0.09,-0.339%,962199906.00,United States,2016,500268,Health Care,Biotechnology: Pharmaceutical Preparations
REVE,Alpine Acquisition Corporation Common Stock,$10.04,0.01,0.10%,136293000.00,United States,2021,9999,,
REVH,Revolution Healthcare Acquisition Corp. SAIL Class A Common Stock,$9.7156,-0.0044,-0.045%,561075900.00,United States,2021,2790,,
REYN,Reynolds Consumer Products Inc. Common Stock,$28.21,-1.93,-6.403%,5917342915.00,United States,2020,1317027,Capital Goods,Office Equipment/Supplies/Services
RFIL,RF Industries Ltd. Common Stock,$7.42,-0.35,-4.505%,74634597.00,United States,,3327,Capital Goods,Electrical Products
RGC,Regencell Bioscience Holdings Limited Ordinary Shares,$35.58,-0.91,-2.494%,461369596.00,Hong Kong,2021,5335,,
RGCO,RGC Resources Inc. Common Stock,$21.92,-0.09,-0.409%,183825241.00,United States,,11995,Public Utilities,Oil & Gas Production
RGEN,Repligen Corporation Common Stock,$200.95,2.59,1.306%,11110229702.00,United States,1986,180548,Health Care,Medical/Dental Instruments
RGF,The Real Good Food Company Inc. Class A Common Stock,$6.20,0.18,2.99%,159634909.00,United States,2021,80004,Consumer Non-Durables,Food Distributors
RGLD,Royal Gold Inc. Common Stock,$102.23,0.43,0.422%,6710100259.00,United States,,279221,,
RGNX,REGENXBIO Inc. Common Stock,$26.10,1.33,5.369%,1116276329.00,United States,2015,530471,Health Care,Biotechnology: Biological Products (No Diagnostic Substances)
RGP,Resources Connection Inc. Common Stock,$17.46,-0.07,-0.399%,567925087.00,United States,,124494,Miscellaneous,Business Services
RICK,RCI Hospitality Holdings Inc. Common Stock,$70.87,1.87,2.71%,673258622.00,United States,1995,65337,Consumer Services,Restaurants
RICO,Agrico Acquisition Corp. Class A Ordinary Shares,$10.07,0.00,0.00%,182392875.00,Cayman Islands,2021,6609,,
RIDE,Lordstown Motors Corp. Class A Common Stock,$2.95,0.16,5.735%,567081164.00,United States,2019,5816562,Capital Goods,Construction/Ag Equipment/Trucks
RIGL,Rigel Pharmaceuticals Inc. Common Stock,$2.48,0.05,2.058%,424095031.00,United States,2000,2012955,Health Care,Biotechnology: Pharmaceutical Preparations
RILY,B. Riley Financial Inc. Common Stock,$61.29,1.32,2.201%,1699080828.00,United States,,216950,Finance,Investment Managers
RIOT,Riot Blockchain Inc.  Common Stock ,$16.57,1.78,12.035%,1931786938.00,United States,,15446242,Technology,Retail: Computer Software & Peripheral Equipment
RIVN,Rivian Automotive Inc. Class A Common Stock,$60.87,0.51,0.845%,54802317581.00,United States,2021,14578727,Capital Goods,Auto Manufacturing
RKLB,Rocket Lab USA Inc. Common Stock,$9.49,0.46,5.094%,4279282018.00,United States,2020,1425970,Capital Goods,Aerospace
